comment_id,post_id,comment,upvotes
gbupdm0,jr5ecq,Is that the one by redgate?,1
gc13btg,jr5ecq,"All languages are SQL, but some languages are more SQL than others.

-George Orwell",1
gbs0trn,jr5ecq,I prefer the prequel more.,6
gbswrb0,jr5ecq,"To put it pretty simply, MS SQL was a sort of follow-up to SQL. All the same mechanics from the original SQL persisted in MS SQL, and the overall goal of MS SQL was the same as SQL - write queries, execute queries, rack up more and more data points. The four stakeholders that would hover about are seen in this version too. Executing a Power Query would make them avoid you. However, as the days go on, your queries would grow more complex, ETL jobs become less reliable, and successive Power Queries become less and less effective, to the point where it produces literally no business value. I don't want to get too technical here, but I'll leave you with the easiest way to distinguish SQL with MS SQL - you'll find MS SQL sporting a red bow and other accents, vs. SQL's plain, yellow scheme.",5
gbttwez,jr5ecq,"I've heard that if you look at too many screens with MS SQL the whole thing eventually breaks, is this true?",1
gbtlmu3,jr5ecq,"Its the same but during important database work MS Sql will insist that you upgrade immediately to enjoy their new security features. Then you can watch a blue screen for 6 hours that reads ‘99% done dont switch off your computer’.

Immediately after the update your computer gets a virus.


Its AIDS.",3
gbszkaw,jr5ecq,Go to W3 School's website and make a meme about cross apply,2
gbuwoi4,jr5ecq,"MS SQL is more specialized, but learning it will be faster since you already have regular SQL under your belt. Don't mistake it for PhD SQL though, that's more rigorous and will take a lot longer to finish - plenty of people have to drop out halfway.",2
gbtzuz1,jr5ecq,"For starters, make sure you pronounce it properly: Miss Squill. Saying it like that will let people know you’re a pro Miss Squiller.",1
gbts7um,jr5ecq,"MS SQL has way better support, where as SQL doesn't, at least in my company",1
gbohbas,jqowyj,They give off a lot of warnings that you choose to ignore.,148
gbpj7ms,jqowyj,"It's not your fault that you ignore them because it's 500 lines of ""You should know why it's wrong"".",33
gbqh2ge,jqowyj,I see you're familiar with C++ and template metaprogramming.,9
gbskif2,jqowyj,Is this a warning?  She seems to perform better for my coworker than me.,2
gbohhj1,jqowyj,"When you write your tip on the receipt without an ""f"" at the end and she says there's no implicit cast from double to float.",110
gboinfx,jqowyj,"What idiot uses floating point variables for storing currency? Use a decimal, damn it!",57
gbpe0wh,jqowyj,Integer number of mills.  This is the way.,17
gbs8wyv,jqowyj,Wrapped in a Currency class,2
gcjfdmi,jqowyj,Store it in an integer as cents and just kill anyone who goes over.,2
gbowv7l,jqowyj,"When they restate everything you are saying in simpler terms, but it's clear they have no big picture understanding of the conversation.",45
gbpwf1p,jqowyj,They freak out over one missed period.,46
gbp0xfy,jqowyj,She points out everything that is wrong with you and doesn't tell you how to fix it.,43
gbrckwn,jqowyj,"Ouch, this one hits close to home",3
gbrq15z,jqowyj,"Hello gcc, I'm home",3
gbs8fw0,jqowyj,"Segfault me, daddy!",3
gbosg1w,jqowyj,They won't KISS.,27
gboinnp,jqowyj,Combining compiler *warnings* with enum *flags* to create the phase *warning flags* instead of using the proper phases: **warning signs or red flags.**,17
gbom3y8,jqowyj,`gcc -Wall`: am I a joke to you?,20
gbp3rxe,jqowyj,They see you as only an object,17
gbp0xpd,jqowyj,You exchange a lot of text messages but never actually link up.,12
gbpdg26,jqowyj,"Constant warnings about how your habits are to be deprecated in favour of better more sane standardised habits.Constantly moving around things in memory without your consent and then bitching at you about the pointers still referring to old addresses.Refuses to do things if you ask in the ""wrong"" way.Expects you to be compatible with every different dialect they support.Makes arguments against you using the full resources of the environment and entire scope of your stack, while you only have pre-approved access to resources and are forced to look only at one piece of the stack at a time.",9
gbpmghm,jqowyj,When they only respond to your mistakes,6
gbpcp20,jqowyj,The --suppress-warnings flag,7
gbpvyal,jqowyj,-O3,5
gbsk8r3,jqowyj,"They use up all your resources, and their output is a bunch of instructions.",5
gbomrhp,jqowyj,They complain if you dont use cor'rect punctuation;,8
gbp9w8d,jqowyj,when they have memory leak from the mouth,5
gbom1yb,jqowyj,`-Wimpersonate-human`,6
gbovs85,jqowyj,Can’t think of any but I do know you’ll be waiting forever for them to finish what they’re doing.,3
gbpwccm,jqowyj,Gives you a gigantic list of all the things you are doing wrong.,3
gbi4sbm,jpz5qa,NaN,45
gbi6wka,jpz5qa,"Mmm, Indian bread...",24
gbiidza,jpz5qa,undefined,5
gbi6d8a,jpz5qa,Object object = new object() { Object = object},15
gbiqti0,jpz5qa,can't get more meta than this,12
gbir1xg,jpz5qa,It's the JS version of [removed].,7
gbj0alw,jpz5qa,    undefined,3
gbi6i0h,jpz5qa,console.error(object);,3
gbiwniq,jpz5qa,"`typeof null === ""object""`",3
gbkxhda,jpz5qa,sizeof(sizeof(object)),3
gblells,jpz5qa,I \[object Object\] to this post.,3
gbi6yx1,jpz5qa,[OBJECTION!!](https://i.ytimg.com/vi/W8QRExBfQhs/hqdefault.jpg),4
gbl5zp1,jpz5qa,Pee poo,2
gbiqkje,jpz5qa,_f_,1
gblxgt1,jpz5qa,"Loling hard, via [XMLSerializer](https://developer.mozilla.org/en-US/docs/Web/API/XMLSerializer)",1
gblxqbw,jpz5qa,"Laughing out loud, via [JSON\_decycle](https://github.com/douglascrockford/JSON-js/blob/master/cycle.js)",1
gbmapzk,jpz5qa,"Why does it even do that? In 8 years of producing shitty javascript, i never quite bothered to find out. Like why not just object? And why between brackets?",1
gbmew6o,jpz5qa,[[object Answer]](https://stackoverflow.com/a/25419538/3655565).,3
gbkfbvr,jpz5qa,let isPostFunny = ( (0.1+0.2) === 0.3 );,0
gbl5z4j,jpz5qa,poop,3
