comment_id,post_id,comment,upvotes
gems70j,k6q5tf,"As mentioned, SSIS is an ETL (extract, transform, load) tool.  It's used for migrating data (transforming as necessary) between a database and another source (which can be another database or data warehouse, flat file, etc.).  Think of it as a sort of software application that serves a very specific purpose and doesn't require any real coding (although you can).

T-SQL is just Microsoft's version of SQL for SQL Server.  There are many like it, but this one is MSFT's.

A stored procedure is an object that is stored in a database that contains T-SQL code to be executed; it's invoked any number of ways - from software, SSIS, ""manually"" via SSMS, or a SQL Agent job are the most common.  They are typically authored to allow the aforementioned processes to perform CRUD operations against a database.  There are also system stored procedures, which live in the system databases on a SQL Server instance (msdb and master are two) and are created when you install SQL Server to the machine.  (They shouldn't be modified unless you really know what you're doing, but there are plenty that can be invoked from user-written T-SQL.)",6
genviwv,k6q5tf,"You write T-SQL commands to perform a specific operation in SQL.

If you don't want to write that code again when you perform that same operation then you save the code as a Stored Procedure.

and if you want to run this code over and over and over with other type of code or other stored procedures or alter and modify data then you can uses SSIS to package them together so that they run in sequence or parallel to perform automated complex processes while you drink coffee and don't have to think about writing code again until a different issue arises.",1
gemp9j8,k6q5tf,"A lot. There's a lot of difference between those things. Google them.

E: I thought this sub was against zero effort posts, but okay cool let's have more of these I love 'em 👍",-5
gemc1a8,k6pf5l,"here is my code and output if it helps

[https://www.mycompiler.io/view/2df1rgz](https://www.mycompiler.io/view/2df1rgz)",1
gemr4p8,k6pf5l,"&gt; Want - All the comps, and the matching user. If no matching user, match to User 1:

join all ""Comps"" to user #1

left join comps to users via id/user.

use case expressions in your select list to conditionally pick values from the second join or first if the second join did not get a match.",1
gemrsqk,k6pf5l,"One solution:

    WITH a_tmp AS 
    (select a.id, a.comp, COALESCE(b.USER, 1) as user
    from a  
    left join b 
    on a.id = b.id 
    and a.comp = b.user
    )
    select 
    a_tmp.id,
    a_tmp.comp,
    a_tmp.user,
    b.userinfo
    from a_tmp
    left join b
    on a.id = b.id
    and a_tmp.user = b.user",1
gem68s7,k6pf5l,Comment to folllow up,1
gemodt8,k6kext,"I have not used BigQuery, but usually this is done by putting a trigger on the table and inserting records into a logging table.",1
geou75u,k6kext,"Thank you very much, this makes sense I guess. It's a bit beyond my understanding right now but I will talk to my colleague about it.",1
gelmne8,k6ihom,"first, what do you understand as ""grouping sets""

second, how is that different from your UNION query

third, how do you know which result rows of your UNION query came from which SELECT?",2
gel9l7r,k6gyt6,"First of all, congrats on making forward moves in your career! Let's answer your specific questions.

&gt;With some more time in this position, can I leverage this job for a better paying position?

Yes, absolutely. Salaries depend on the area you're in, but in / around high cost of living areas, support roles get paid at least 60K a year. Entry level development jobs get around $75k a year (unless you get a job at a big, presitgous company, which can pay more).

&gt;What positions would be relevant for this?

A few positions come to mind, based on the experience you've described

* Your experience working with databases could be translated into a junior database developer job. [Here is an article I wrote about how to get a job as an entry level database developer](https://sqlref.com/blog/how_to_become_a_database_developer.html).
* Your experience with nodeJS could be translated into a junior web developer job.
* Your experience administrating a CRM would qualify you for an operations type role. There are lots of jobs in tech companies that require you to be technically savvy, but maybe not write code.

&gt;I have no degree, but have heard that experience can offset this in some fields, is this the case for reporting?

Yes and no. Some companies don't care if you have a degree, but some companies won't even finish reading your resume if you don't have one. Experience is always good, though!

Feel free to ask more questions, I'll be sure to respond.",7
gembdh4,k6gyt6,That is one hilarious video! HAHA! I think this is going on my to-do list. Thanks.,1
gel2ug2,k6gyt6,"Well, it sounds like the initial promotion was more of a QA role with some reporting functions, which, honestly you were probably still being underpaid for. The stuff you’re doing now, yeah, you’re being underpaid.

You did a good job of selling your achievements. You can leverage that experience to get something better in the future.",16
gel8rk9,k6gyt6,"I always say, assume you're going to be underpaid in your first tech job. The problem is breaking the cycle of ""we need x years of experience and proficiency with SQL"". Becoming proficient in SQL is not a difficult task, convincing someone to hire you with 0 years of experience is a much harder task. Once you break that threshold, get a job, and start getting experience- that's when you plan for a higher paying job. 

These places that don't pay much either 1. Know they're underpaying but providing experience for someone, leaving themselves open to a very high turnaround rate for the position, or 2. Terribly stupid management that doesn't respect IT inherent worth. 

The first developement job I had was grueling, demanding, and low paying. I stuck it out for 2 years there and gained some amazing experience. The next job I got after that I literally doubled my salary. 

The next steps for you that I would suggest: 1. Stick it out for atleast 2 years where you're at now. I know it sucks being underpayed, but it will pay off. 2. Find ways to work your job to get the experience you need to get yourself to the next job you want. 3. Get in contact with IT recruiters, they are a major help and are usually great people.


Best of luck!!",7
geldpbz,k6gyt6,"Dip some hints that you think you're underpaid.  If you don't get a significant raise in a year,  then take this experience and hop to a job paying at least $70k.",3
gelc29m,k6gyt6,"Congrats,

Yes, I'd call your position report writer or reporting analyst. I do data warehousing, I don't have an it degree. People don't care about your degrees, they care if you can do the work.

Learn everything you can from your peers. Read other scripts, see what they do. When you don't understand something Google things first, but then ask around the office see why they did that.


Pay is very dependent on where you live. If your in rural parts of the USA, your paid normally. If your in Chicago, your paid less than half of what you should be earning. Start there for a year, build your resume. If you don't get a huge raise, see what else is available in your area.",2
gelki18,k6gyt6,If you aren't in the US the salaries people are mentioning in the comments likely aren't applicable. Knowing what country/region you work in is important.,2
gelh2ow,k6gyt6,"First of all kudos on showing initiative and going above and beyond. 

Like others said you don’t need a computer science degree to work in IT. As far as where you would like you career to move, you have to make some decisions. If you like write SQL and work with data preparation then you can start a career as a data engineer. If you’d like to create dashboards then look at BI/Visualization jobs. I would also say learn snowflake given you already know SQL and it is all the rage now. I think you should be making at least 80K with 1-2 years of experience.",1
gelnkd7,k6gyt6,"Focus on building up experience keep reading books and building up your skills even on the hard days. The reality is, most people starting out become tired and lose focus that they can ever actually make more. Ambition and drive quick disapears for them. 
Don't get sucked into that trap. As you get better and better, people will start to get tired of you, this is good. It means you are out growing your role, that's when the good opportunities open up. Above all, always stay humble and a good person (you are also actively being watched by other teams).",1
gem6g4a,k6gyt6,I think you should learn some python and start automating things you can,1
gemo6pl,k6gyt6,"If you got a small bump up from $30k you are almost definitely being underpaid. I would keep an eye out for BI Analyst positions, as it sounds like you not only have some level of competency in coding and SQL, but an aptitude for understanding and analyzing actual operational data.

As an example, a credit union near me recently had a job posting for a BI Analyst, technically all they wanted was a 4-year degree and if you didn't have that they wanted 3 years of experience in report creation. The advertised pay range was $70k-$105k. This is in Iowa, definitely not a high COL area.",1
gentnjf,k6gyt6,I agree on BI Analyst. Seems like a good fit,1
genthzt,k6gyt6,They gave you (a person with little database experience) the task of completely redoing an entire database? Is that a major project or a side thing? Will this be in Oracle? I’m struggling to grasp what kind of environment you are working on. How does the data get into the products database? Is there automation?,1
geo0sxq,k6gyt6,"That's awesome!

If you don't get offered a raise to at least 55k after 6 months in that role, move to a new job. Once others see you got paid for reporting, then you seem much more qualified. Rearrange your resume so someone who glances at it would think you had more time than just a few months doing reporting. During the interview, if it comes up, talk up how you self-studied and got a big promotion. If the next job asks what you were making, you don't have to tell them, but they also can't verify when you say you were getting 65k. Seriously, 6 months work experience, especially with your desire to learn, is enough for a well paying job. Degree not needed.

Get as many measurement numbers as you can for your resume to quantify the impact you've had, listing out any automation. Ex: ""Created automated Node.js web bot to increase worker efficiency by 100x.""

Also, things like ""Proposed projects to C-levels and implemented accepted projects as part of the engineering team"" to show the ability to speak c-level and technical.

Jobs don't have a naming standard either, so look for jobs with the words Analyst, Report, Reporting, PowerBI, Tableau.

Likely, Data Engineer and Data Scientist are too broad and high for you right now, but see if those seem like a sounds interesting for focusing your learning.

All of Florida has lots of SQL and Reporting related jobs.

Some places to look for training, on the Microsoft side of tools:  
[https://www.pass.org/](https://www.pass.org/)  
[https://www.pbiusergroup.com/](https://www.pbiusergroup.com/)  
[https://www.sqlsaturday.com/](https://www.sqlsaturday.com/)",1
gelerom,k6gyt6,"My company is 100% remote and I probably wouldn't offer even a super junior person anything less than 65k and that's the bare minimum. Keep doing your job but start looking for a new one. With experience it shouldn't be hard.

And if you get questions in interviews as to why you're looking so soon after getting promoted, be honest and just say they're underpaying you",0
genu1vs,k6gyt6,"I have been one of the main people to interview candidates at my last two jobs. I wouldn’t suggest he say they’re underpaying. I would suggest he says that he’s looking to grow his skills in a more technologically advanced department where he can contribute more. Even going further to say hes looking for mentorship. If he’s just looking for money, he’ll end up unhappy and it doesn’t come off good to lead with that, imho. Focus on the people and the money will come.",1
genvt3m,k6gyt6,"I'm on our hiring team as well. I'm not saying he says, I just want more money. But if someone said I feel like I'm under paid given the value I can bring, that would be 100% fine.

I feel like I work for one of the best companies in the world but I'm not going to lie and say I'd do it for a salary way below industry averages",1
genwaw6,k6gyt6,To each their own!,1
geknlyx,k6g96b,Link: [https://www.reddit.com/r/SQL/comments/k66t16/sqlite3\_import\_all\_columns\_got\_merged\_into\_one/?utm\_source=share&amp;utm\_medium=web2x&amp;context=3](https://www.reddit.com/r/SQL/comments/k66t16/sqlite3_import_all_columns_got_merged_into_one/?utm_source=share&amp;utm_medium=web2x&amp;context=3),1
gelb3ov,k6f7lf,"It's not just about the data size. You need to understand how much memory/compute capacity you need too. Either to size a VM, or to be on the correct tier of PaaS (Amazon RDS, Amazon Aurora, Azure PostgreSQL) because those charge by the hour based on your compute capacity.

Be careful hosting data you care about on the ""cheapest plan."" You get what you pay for. Maybe if your 200GB of data isn't terribly important to you, you can get by. But I'll pay a little more to get something that's kept secure and backed up, with reliable &amp; consistent performance.",4
gekl6ua,k6f7lf,VPS? Linode?,1
geleti9,k6f7lf,without any detail it's definitely self-hosting. 200GB is less than 30$ ad vitam.,1
gejwdzg,k6b1uj,Can you post it one more time please?,7
gek5yx7,k6b1uj,I thought my feed was broken,1
gekw10h,k6b1uj,"What's wrong? I was having trouble posting on reddit last night, works fine for me, should have known something was up haha.

Here's the OP:

So I don't need a full parser, I just need to throw a query at it and get back tables/views/stored procs etc.  I literally only want the objects that are used.

I have access to the SQL database the queries would run on so can solve using a query if possible and I'm also using python.

I've tried a couple packages but they're either for python2 (im on 3) or they fail on the second example below.

I mean, intellisense can technically do it so there should be a way, I hope.

Example:

    Select * from 
    ( 
        select column1, column2 
        from table t 
        join table2 t2 on t.id = t2.id 
    ) x
    Where column1 = (select top 1 column1 from table3 order by column2)

Returns: table, table2, table3

    EXEC @Var = MyStoredProc

Returns: MyStoredProc

Any help would be greatly appreciated.",1
gek1o3i,k6b1uj,See if [this approach](https://port1433.com/2017/12/04/whats-in-the-box-validating-sql-server-scripts-with-powershell/) works for you.,2
gekw224,k6b1uj,"Ohhhh that looks interesting, oh wow, much appreciated.  Will try it and see how far it takes me",1
gekvngu,k6b1uj,Make a view and look at depenencies?,1
gekw8l5,k6b1uj,I can't put stored procedures in a view and especially the EXEC @Var query is what I need,1
gejvip6,k6b1r1,"Things like that, that are mappings, I would generally put them in a table and then just use that.

Number, translation

Uno, 1
Duo, 2
Trio, 3

Then in your query join to this table on number and then sum translation",3
gek604d,k6b1r1,"The simple answer is ""Yes"" you can perform calculations and translations on the ungrouped fields inside the aggregate function like below...

SELECT *, SUM(case screws when ‘Uno’ then 1 when ‘dos’ then 2 end), COUNT(reg_number) as 'total_amount' 
    FROM store; 

...as the other user commented, depending on the nature of the translation it may be more efficient to use other methods but it will work as shown above, it just might not be fast depending on other factors.",2
gekw8ue,k6b1r1,"Thank you very much, I understand it's probably a bit ugly to look at but it doesn't matter if it's a little slower in this case.",1
gelm337,k6b1r1,"The proper syntax for the sum in your SELECT clause is : 
SUM(CASE WHEN screws = ‘Uno’ Then 1 WHEN screws = ‘Duo ‘ THEN 2 WHEN screws = ‘Trio’ THEN  3 ELSE 0 END)  as colname

It’s not that intensive to do this tbh. I usually do it with 1/0 type things but this is just fine.",2
gemc1yn,k6b1r1,"Oh, I see, thank you, it worked either way but it's always better to use proper syntax.",1
gemcs3j,k6b1r1,Actually if it worked the original way then I just learned something new. Didn’t know you could write a case statement like that. Both syntax ways would probably be considered “proper” but I’ve only seen it the way I told you so just learn how things are done in your department and do it like that.. so that other analysts may decode your work more easily in the future.,2
geksxsu,k6a0sc,Postgres is awesome as SQL database,3
gelqyh1,k6a0sc,Possibly will give it a go if I can get the db admins aboard.,1
