comment_id,post_id,comment,upvotes
gdbfm5r,jz02ql,Very cool. I wonder if it might be a good idea to limit how often it can 'tap' to make it have to work within more 'human' parameters?,1
gdbi3zp,jz02ql,Yeah good point. However it was already hard enough to get it where it is at :D maybe for a future project :) someone else also pointed out that the real flappy bird has some different and more difficult controls.,1
gdbtm0p,jz02ql,Very cool!,1
gd4d42q,jyjhk4,It's all fun and games until they upgrade the hardware and let it fly further... lol,63
gd4dgs1,jyjhk4,Its fine we'll just let the end user test it in production,35
gd4k78p,jyjhk4,That'll definitely end the user.,28
gd591ao,jyjhk4,They just have to slow down the CPU a little...,10
gd5prs4,jyjhk4,"That's what happened with a rocket once, except it was an overflow error and it caused the rocket to go off-course. They lost an expensive satellite.

Though memory leaks are different from overflows; they are still issues you don't want.",8
gd5ip9c,jyjhk4,Strap more ram to it,4
gd6nxyy,jyjhk4,See it was funny without that stupid dog shit at the bottom. Why do people insist on fucking up perfectly good things?,-11
gd6txty,jyjhk4,Sir we post memes here,26
gd6ymzw,jyjhk4,"It's also a low-res screenshot of text, or did you not notice that?",0
gcrtihu,jwl4y4,"You actually voiced over instead of writing into notepad, 0/10 and unsubscribed.",28
gcrxq5n,jwl4y4,That is for the super advanced PHD level tutorial where i cover recursion at lightning speed,13
gctbxio,jwl4y4,Can you go slower than lightning speed? I couldn't catch up unless we meet in a black hole or something.,3
gctxxpw,jwl4y4,Just set the video to play at half speed and you should be good,2
gcrxbka,jwl4y4,"thanks, my CS courses didn't cover randomness so this video was really helpful",12
gcrxlo0,jwl4y4,glad I can help. Shout me out when you get a job at Google,6
gcry1di,jwl4y4,"Teacher, I found a bug in this program. Even after 5 shuffles the list isn't random enough as I got two consecutive numbers in a row. Who should I email about this?",10
gcs2p1h,jwl4y4,"its in the syllabus, which will be available 1 day before the final exam, which you have to pre-order 3 seconds before the semester started and it costs about $69420.",13
gcsvutj,jwl4y4,Semester?  Will this also be offered as a two week boot camp?,2
gcsxd8f,jwl4y4,yes of course. It has a guaranteed job offer upon graduation (wages may vary from $0/hr to $8 million per second),6
gcsivms,jwl4y4,Nice,1
gcs645p,jwl4y4,This is art.,3
gcsxe6s,jwl4y4,Thanks. I always though programming was more artsy than most other art things,1
gcsfb9c,jwl4y4,I was not ready for the theme switch.,3
gcsxelo,jwl4y4,You mean the best part?,2
gct55n4,jwl4y4,"You forgot to mention the part where you could make it a lot faster if it was in C, but that pointers are just too complicated.",1
gct5vr7,jwl4y4,I dont even know what pointers are /Thano's voice,2
gctpvsu,jwl4y4,"With how high you keep looking up at your IDE, RIP your neck",1
gcuhsc8,jwl4y4,"""Don't ask what these key words mean.  Nobody knows, and if someone says they do, they're lying.""",1
gcr7lqi,jwduh4,Isn't that a how to basic video?,3
gcseggf,jwduh4,Yes..It is..,1
gctvsf2,jwduh4,"Not really your content then, is it?",2
gctyxki,jwduh4,You can say that...It was just for fun..,1
gcpj23r,jwduh4,This is such a quality post I’m not sure if it qualifies as a shitty shitpost anymore!,7
gcqqwj4,jwduh4,yeah i do this everyday,2
gcpyr8k,jwduh4,"I'm in this video and I don't like it

*issues DMCA takedown for use of likeness without permission*",2
gcjj501,jvfaml,[deleted],101
gcjwbtl,jvfaml,I can verify that was never the case. Maybe scared of this package [https://golang.org/pkg/encoding/json/](https://golang.org/pkg/encoding/json/)?,14
gcjxnjf,jvfaml,"That still wouldn't explain why he didn't just write

    Buffer.WriteString(""\""resource\"""")

instead of using separate calls for every quotation mark...",17
gckdmqt,jvfaml,"They very obviously are afraid of escaping characters and ""have seen some weird shit before.""  So in their mind, this was preventing a bug that creeps in from some strange edge case when in reality they just don't understand how string formatting actually works.",23
gd523hl,jvfaml,"But that's the weird thing. They do escape some of the characters. The quotes are escaped:

    buffer.WriteString(""\"""")",1
gcjyw73,jvfaml,[deleted],7
gcjzonn,jvfaml,"I highly doubt that this is in any way related to optimization. An access token request is usually done pretty infrequently, and it's going to be network bound. Trying to shave off a few microseconds with some weird string tricks would be insane in its own league. But I also highly doubt that more buffer write calls could ever mean faster code.

Also, why not just use printf...? (or whatever equivalent Go has)",11
gcna8tj,jvfaml,"&gt;Maybe there is some weird black magic optimization here

Function call overhead would surely destroy whatever gains are being had.

Back in the day, C compilers would notice when printf is being given a string literal, and replace the call with a call to fputs.  But that's still replacing one function call with another; this guy is replacing one function call with dozens...

Maybe he was just really, really good at hiding his meth habits?",1
gclwdh4,jvfaml,Performance should be measured by how many lines you have deleted,4
gcjevvn,jvfaml,"I'm sorry but this should have the ""NSFW"" tag.",36
gcjerom,jvfaml,I have so many questions,14
gcjex5m,jvfaml,After all this? I have none.,10
gcnahsb,jvfaml,"Same, but I don't actually want the answers, at least not without beer.",1
gcjps32,jvfaml,"Well, at least it’s easy to read.",13
gckvupv,jvfaml,"Despite the ugliness, this is much faster than json.Marshal.

That said, what the actual fuck.",6
gckj0mb,jvfaml,"I'm a chemical engineer that writes shitty scripts to automate things, but this is a whole new level",6
gcjvot3,jvfaml,"Can someone please explain how you would make this code better?

I suppose they can consolidate some commands into a single escaped cluster fuck, but besides that, what else can be done? 

I don’t do a lot of web programming, but the times I have I was always passing around huge mega strings. How would you even get around that??",4
gcjyg1r,jvfaml,"Well, first of all, they could've just used a JSON library to generate the JSON. But even if they didn't want to use a JSON lib, they could've used... idk, printf? Yeah I know, it's only been around for 50 years... Or even without printf, why write

    Buffer.WriteString(""\""resource\"""")

in three seperate lines? There is no conceivable reason for doing that.",11
gclott8,jvfaml,"To be fair about the JSON library; the Newtonsoft JSON library for C# [doesn't even follow the json specification](https://github.com/JamesNK/Newtonsoft.Json/issues/818) correctly, on purpose. Yeah, I get that trailing commas are convenient but the parser on the other end in a different language doesn't think so.",2
gck710v,jvfaml,He probably didn't know how to escape chars,-1
gcjxkeg,jvfaml,"Something like 

jwt := json.Marshal(&amp;config) 

would do this in one line.",5
gckh5h7,jvfaml,Well to be fair the core json marshal/unmarshal is extremely slow.,1
gcknexp,jvfaml,How frequently does the jwt config change where the milliseconds of time improvement in rerendering 6-7 arguments using some non standard json marshaler matter?,7
gcknk8g,jvfaml,Not to mention there is an easy way to override the marshaler and also fastjson library.,3
gcmeopg,jvfaml,"This looks like golang so it doesn't even get the ""legacy code from a different era"" pass...",5
gcjnh6s,jvfaml,Jesus Christ Reddit.,3
gcmgz09,jvfaml,"Look, 99% code coverage.",3
gcjpma6,jvfaml,Is this autogenerated hopefully?,4
gcjvt1q,jvfaml,Nope not auto generated :(,7
gcjj7r3,jvfaml,This is how you ruin Auth workflow maintainability,1
gcl1nvc,jvfaml,Looks like he didn't realize you could escape special characters inline with other characters as part of one string,1
gcn4qf2,jvfaml,"What, you've never written code with the intention of fucking with subsequent maintainer's minds? I usually add a comment that has might be relevant but in actual fact has very little to do with the implementation, and add mention of my Cairn Terrier, Stroustrup\* in there somewhere as well.

\*He often makes it into particularly brain-dead Jira tickets as well.",1
gcqvygy,jvfaml,This guy probably just hates your company,1
gchlgeq,jv375n,Flase crowd checking in.,19
gchetw4,jv375n,"const Fales = false;
Fales == false; // true",13
gchfgju,jv375n,I just set `false = False;` at the start of my program so my IDE autocompletes it.,9
gchf122,jv375n,"""False""",3
gchzyz5,jv375n,`&lt;script type='text/javcascript'&gt;alert('hello world');&lt;/script&gt; &lt;!-- why is this not working?! --&gt;`,2
gci3nj0,jv375n,Ok but what about ```SafeL```?,1
gci8foa,jv375n,"This is why you should always have aliases for lenght, widht, and weigth.",1
gcigpft,jv375n,"#define flase false

problem solved",1
gciivhi,jv375n,No love for `fasle`,1
gchcbs9,jv375n,Boring,0
gcdcdvf,jugqs0,Some folks over-engineer their code as a way to secure their jobs. 😁,26
gcdeu35,jugqs0,cant replace me if you dont understand my code,27
gceb7qr,jugqs0,Exactly 🤖,3
gcegv3k,jugqs0,Then they leave and you get handed a notebook full of gibberish and shopping lists and shit for handover haha,3
gcfl3dg,jugqs0,That's a lot of work when you can just go the obfuscation and no comment route and get the same result.,1
gccvw73,jugqs0,"javidx9 is one of the highest quality coding channels out there, absolutely love his videos.",17
gce57q5,jugqs0,[Enterprise FizzBuzz](https://github.com/EnterpriseQualityCoding/FizzBuzzEnterpriseEdition) is a glorious example of this taken to the extreme.,16
gcfhr42,jugqs0,"Okay though hear me out it's insane/unnecessary, but kind of an example of a bunch of design patterns in a Spring context.",3
gcfurpv,jugqs0,If you like your design patterns presented in a needle &amp; haystack fashion I suppose it could be considered almost educational in places. I think the world will be a much safer place if its use is restricted to a demonstration of the perils of not knowing when to stop typing though!,1
gelgmst,jugqs0,That's... that's *beautiful*.,2
gcdhnf1,jugqs0,I won't lie I'm kind of guilty of doing this at times. I was taught horribly at University :(,6
gcdl574,jugqs0,"It does seem to be the Uni grads that do this at my work tbh. A lot of my self taught devs write beautifully simple code, while the grads create these over engineered blobs. I constantly have to remind them, YAGNI!!

That could just be at my work though, not saying it’s true everywhere",6
gcdsbuf,jugqs0,"The problem with Uni is that typically you're graded on how much code you know rather than the quality of the code. I distinctly remember in year 2 coding a game which had multiple levels whereby you defeat the enemies, go through the portal and into the next level. I quite easily beat the other students who only had one level in their whole game, nobody else had something like I did. I showed a ton of technical skill getting this to work and as a result, got a high grade for my efforts.

The code itself is fucking *shocking* and is an absolute mess, I struggled to read it myself when revisiting it. Most definitely not elegant or readable without great effort. But, like this video, I showed off how much I knew and it got me a good grade. However nobody at Uni tells you this isn't good code at all for real world scenarios.",3
gcdyw2h,jugqs0,"I am a programming dunce and compete in contests.  I take hours to come up with absolutely bizarre, convoluted solutions to problems that work.  Then I look at the one line (python) solutions others have written and am embarrassed.",4
gce98s6,jugqs0,"I like to think of this as the fizzbuzz effect. No matter what you think of, there's always someone out there who's done it more cleanly.",3
gce0o5u,jugqs0,YAGN?,1
gce5krb,jugqs0,"You Aren't Gonna Need It

aka don't write code for a use case that might not happen.",8
gce6fzd,jugqs0,"""sometimes I actually work with other people's code""

I'm gonna have to revoke your ""One Lone Coder"" title",5
gcdtnbc,jugqs0,"Even worse is when libraries or frameworks over-engineer their examples just to show off. I mean everyone wants to show what their framework can do, great. But don't bother with providing the code for it if it's completely illegible.",3
gce2syr,jugqs0,"Oh, boy, thank you! I saw this video long ago and more than once since then I tried to reference it but couldn't ever find it again. Bookmarked!",2
gce8qeo,jugqs0,Sometimes over-engineering is the only way to make the project interesting and motivating.,2
gce9dj4,jugqs0,"This is a terrible video. The given examples of ""over-engineering"" are

1) Getters/setters for everything. Almost never a bad idea, almost always a good idea, including this case.

2) Namespaces. If you want your code to be reusable -- always use namespaces.

3) Over-commenting. Never a problem (any decent IDE can hide comments), but one comment explaining a (seemingly) obvious thing can save a lot of time for someone using your code (including future you). 

4) Unnecessary templates. Could be over-engineering, but in this case, they don't harm and may be useful. 

5) Adding X ? true : false. Just making code shittier for the sake of it, has nothing to do with over-engineering. 

None of the examples (except for templates abuse) have anything to do with real-live examples of over-engineering.",6
gcff5xq,jugqs0,"i feel like you're being a little too on the other side here, either way even though his used examples are shitty, who cares about the re-usability of a dime-a-dozen class structure? and we all hopefully know the feel of what hes talking about in the video (unless you are the one making your code ugly)

it's all about the use case, his example doesn't apply necessarily to his professional experience but it still illustrates the point. obviously that specific class is over-engineered for its specific use case, who cares if those practices are professionally ""good""",4
gchdfg8,jugqs0,"&gt;and we all hopefully know the feel of what hes talking about in the video (unless you are the one making your code ugly)

It's hard for me to relate in any way to this video. But it's ok, it's not his job to make everyone enjoy his video. But people new to programming can be extremely harmed in long run by seeing this. 

&gt;obviously that specific class is over-engineered for its specific use case, who cares if those practices are professionally ""good""

His example doesn't have use cases, it'd purely educational. And educational examples used to ridicule standard practices is a very strange idea.",0
gcebiqr,jugqs0,post this comment in the youtube video,2
gced22w,jugqs0,Youtube comments is a scary place :-) You can post my comment there if you want.,6
gcex7rg,jugqs0,"&gt;	2) Namespaces. If you want your code to be reusable -- always use namespaces.

I assumed he wasn’t being serious when he implied namespaces are overengineering. Anyone who has worked on a codebase with more than a handful of dependencies or a handful of developers knows how important namespaces are. 

As the amount of code increases, the chance that there will be some naming collision also increases. Imagine if you went to commit this code but found out that there’s a different Shape class defined somewhere else in your codebase. Now you have two distinct definitions of the Shape class in the same codebase. That’s eventually going to break something. Using namespaces is an easy way to solve this problem.",5
gcfoa6m,jugqs0,Though I suppose namespaces will not actually help you avoid name collisions within a single vocabulary. The exact same thought process that goes into placing two Shape class declarations into different namespaces is the exact same thought process that would otherwise name the Shape classes more appropriately.,2
gcfsdxb,jugqs0,"Depends. Shape is not a particularly descriptive name, so in this case that's true. However one could easily imagine a situation where there are multiple components with similar (but different) functionality that could accidentally be named the same thing. Namespaces help in this case. 

In a language without namespaces, you typically have to add some prefix to all the types and functions you define in order to prevent collisions. This can make the names very long. With a language that has namespaces, you can use namespaces to keep the names shorter.",2
gchi1zj,jugqs0,"Yes - my point is they don't substantively prevent name collisions, it's mostly a convenience for name qualification. I suppose they do prevent them if the language supports namespace aliasing (e.g. `import X as Y`), which actually changes how a name is qualified as opposed to just being another mechanism for qualifying names. Additionally, in a compiled language a name collision is detected at compile time, so it's not as if one must act defensively against this case. Personally I see namespaces as much more useful for managing multiple vocabularies, e.g. using libraries.

Anyway, neither my point nor the video's is that namespaces are bad; just that that clarity comes first, not using a check-list set of features that may be useful one day, maybe. That's what makes programming an art - to show what is important!",1
gceexvc,jugqs0,"Hang on, I didn't watch the video but are they really claiming that **namespaces** are over engineering???

Id like to see what this guy works on besides YouTube videos that doesn't benefit from namespaces...",3
gcem3q3,jugqs0,"&gt;Hang on, I didn't watch the video but are they really claiming that namespaces are over engineering???

Yeah.

&gt;Id like to see what this guy works on besides YouTube videos that doesn't benefit from namespaces.

I bet he's either a clown who has no idea about the standard practices or is a professional developer who always uses namespaces, but decided to make this clown video for attention.",-4
gcduol8,jugqs0,"Oh no I've seen this video in my recommendeds so often but never noticed the typo in the thumbnail until now because it was always small but the reddit preview makes it huge

Can't unsee aaaaahhhh",1
gcfe55v,jugqs0,wait you can have getters and setters in C++? someone plz teach me this magic.,1
gdjkths,jugqs0,"This is shittyprogramming after all, so:

Install Python, just give up on doing anything big enough that you want getters in C++. That is just a way to invite misery.",2
gcfqj1y,jugqs0,"People who wrote the GNU coreutils:

They are bloated with useless arguments and tons of comments.",1
gcdrwa3,jugqs0,"This is awesome. I'm going to post this to my team slack and hope some people take the hint. Seriously tho, this is good advice",1
gdye37n,jtg53d,"Lol, I actually really enjoyed this and subscribed to see what you do next.",1
gc5n0pk,jtg53d,WOW Great idea :),-1
gc5orny,jtg53d,thank you!! :)),-1
gc2ocvw,jszkpz,Back in my day we called this commitlogsfromlastnight.com,21
gc2ompu,jszkpz,"Yep, indeed. Hence the inspiration link in the top right.  


*(inspiration cause* [*commitlogsfromlastnight.com*](https://commitlogsfromlastnight.com) *isn't maintained anymore and the cron worker hasn't added any commits in 2 years)*",10
gc4w38s,jszkpz,‚Fix: fuck you cors‘ speaks out of my soul,5
gc462oa,jszkpz,"this site is pure gold! 
made universal vars because fuck you
wish it could chain the commits si we could see the glory of trying to fix something we just fucked up",4
gc5sn5s,jszkpz,Fuck cors is right.,3
gccgcr8,jszkpz,im not even close to a 10xer but my commits look like these too,2
gbx2ooi,js3822,The worst thing I have ever experienced is simulink files with different versions of MATLAB. Absolute cancer,33
gbxd2l7,js3822,"Right in the feels.

Also the complete nonsensical idea behind the fact that the code you write inside the GUI / app builder is packaged in a binary, so any effort of tracking code via git goes down the drain.",8
gbxiihb,js3822,"the file format is also pretty ""fun"". I had the ""pleasure"" of writing a parser and serializer for that format for a company that does pretty much everything with MATLAB and SIMULINK once.",9
gbzxz44,js3822,What kind of monsters would do that?,3
gc00fqe,js3822,"they effectively used matlab files as a data interchange format between different tools. some recorded data from things the company built, soms analyzed it, and produced new matlab files. They also had other data formats, and one of the internal tools needed import and export of matlab, since they at that time did the conversion manually in a second step.

The mat file format is pretty wild:

It's one big list of type, length, value blocks, one after another.

the types are

- Integer (8, 16, 32, 64 bit, signed and unsigned)
- Double and Single precision float
- Matrix
- ""Compressed"" (really means zlib data containing matrix)

Matrix is funny, since it contains a second header containing the rows, columns, and type of thing in the matrix. also, every matrix has a name, because of course it does.

that is however a _second_ kind of type, with different constants for the same primitive data types I listed earlier. matrices come with a ""flags"" field that is left empty for most matrices. matrix only also has new data types such as CHAR. if I remember corrextly, there was some kind of weirdly hacked in unicode support as well, but that's badly documented (don't worry, the unicode support is not the best)

the matrix header also contains the number of dimensions and the size of each of them. Matrices are stored in column first order, and if the complex flag is set, then the imaginary values are stored in column first order after the real part matrix. (yes, you can have complex CHAR matrices in the file format, I don't think they make sense)

strings can only be stored as matrices. an array of strings is therefore a 2xN matrix, filled up with null bytes.

yes, they store [""hello"", ""world""] as ""hweolrllod"".

if you have a matrix containing different data types (e.g. in one column double, in one column complex long), then you get a matrix of 1x1 matrices. yes, that means you have a matrix header for ever element. talk about overhead.

There's also the ""struct"" matrix type, which is a matrix where I believe each column also has a name. the names are defined inline before the data. there are a bunch more special types for sparse matrices and ""object"", but that's too much detail I think.

every global variable in the .mat file must be a matrix (with the global flag set). the variable name becomes the matrix name, and if the variable was just a number it becomes a 1x1 matrix.

Also, at the beginning of the file, after the magic number, there are a few hundred bytes of ignored data where you can write a plain text description into.

This was Mat5. the newer Matlab 7.3 format I think uses HDF5.

(EDIT: off by one in file format version)
(EDIT2: fixed misremembered types)",5
gc07t2j,js3822,"You lost me at ""they""...

For real though holy crap I can't think of anything more awful. At least you had your job security",2
gc12abf,js3822,"sadly, no. I was a summer intern at that company",3
gc1nlky,js3822,"What the.....


I'm glad you said ""was""",3
gbxroal,js3822,I forgot I had repressed those memories. Thanks.,5
gby5540,js3822,"The worst is workplace variables. I'm anal about putting ""clear"" at the beginning of all of my scripts now because I've turned in assignments that, unbeknownst to me, relied on workspace variables. Fuck that",14
gbx69vt,js3822,"I don't get it. What is the issue here? The IDE takes a few seconds to load (so do all ""big"" IDEs for other languages) and it gives error messages if you mess up the code (isn't it *supposed* to do that?)",16
gbxo4p8,js3822,"At least at my University, Matlab was run off of a network drive, making it impressively slow.",9
gc0gfny,js3822,"We got the pleasure of using a severely outdated version, because that was the only thing there was a license for.",3
gbxbed7,js3822,"No real issue there, i was just frustrated at matlab a few days ago. We got a school assignment with botched instructions and botched check script. This is just some nonsense i threw together for my fellow students to improve their mood a little",16
gbyhdte,js3822,"Ok, and where's the shitty programming? Go to some other sub with your frustrations. Maybe some n00b programmering subreddiy",-13
gbz16ci,js3822,"&gt; Ok, and where's the shitty programming?

It's MATLAB; shitty programming is a given.",15
gbyp8et,js3822,At 0:10? I can assure you that it’s pretty shitty comming from a noob,1
gbza46h,js3822,Why is no one talking about Ainsley Harriott peeking over the hill!!,2
gc0ux6b,js3822,What? That’s always been the windows background,3
gbr7tsn,jr5ecq,"""Regular SQL"" is a joke in of itself isnt it",32
gbr7z4s,jr5ecq,Surely,8
gbtv1b8,jr5ecq,"Today I learned that some databases support regular expressions in queries, *including backreferences*. I threw up a little.",5
gbr9av9,jr5ecq,"In MS SQL, instead of and/or/not gates for operators, there's just one operator called bill gates. Bill gates will fetch all input and never return anything.",73
gbswoqa,jr5ecq,"MS SQL costs the same as SQL, but only makes 70% of what SQL makes.",22
gbs1zin,jr5ecq,"You have T-SQL which is just like normal SQL but if you insert a customer called John Connor the server turns into robot and hunts them down.

This causes locking while the process completes",11
gbtcdyl,jr5ecq,"MS SQL is a bit like MY SQL but everything you do with it is owned by Micro$oft, instead of you (MYself).
In regular SQL nobody owns the datas.",10
gbttchp,jr5ecq,"Wait, in regular SQL nobody owns the datas? I didn't realize I learned communist software, I am disgusted.",7
gbuozi7,jr5ecq,"No, the communist version is OurSQL.",4
