comment_id,post_id,comment,upvotes
gepqjq8,k73e37,Nice shitpost,1
geliy5p,k6lt6t,"After crafting this highly useful program, I wrote a post on [medium](https://lucasreta.medium.com/cligol-and-gifeegol-d5509a154bf6) (sorry) detailing how one could follow in my footsteps.",19
gemgrlw,k6lt6t,"Gosh. Medium has turned into shit, if we have to apologize like if its a PDF.",11
gempk41,k6lt6t,I thought that was only an issue back when everyone used Adobe Reader and it slowed everything down.,3
gempsm4,k6lt6t,Age showing again.,2
gemswd5,k6lt6t,"Remember when websites used to warn you when a link went to a PDF?

/u/flarn2006 remembers.",3
gemunbh,k6lt6t,🙃,2
genm2ys,k6lt6t,...does it involve meticulously planning your next twenty years of github contributions?,6
gelqne3,k6lt6t,This is actually really cool! Are you sure you submitted to the right subreddit??,11
gelucfz,k6lt6t,"Thanks, glad you liked it!

Posted it here because even though it was fun doing it isn't useful, and because r/programming doesn't allow crossposting gifs.",5
genc8e9,k6lt6t,The interesting yet thoroughly contrived and pointless is more than welcome 'round here. It's all part of the Shitty Way,2
gem3p22,k6lt6t,"Great stuff!  Now do it without JS, i.e., using only well-timed commits, iterating once a year",6
gemiuvd,k6lt6t,"I can criticize you for doing it if no one else wants to. It's the shittyprogramming subreddit after all.
What makes it different from a simple console display game of life is that your display function translates x,y to a date and color to commit count. I think that's little effort for a little achivement. Barely worth the mental capacity to even discard the idea.",-1
gemk5lo,k6lt6t,"I'm mad enough at myself for even having thought of it, worsened now that you point out discarding the idea was an option, instead of wasting time on such a shitty achievement.",4
gemlixm,k6lt6t,"I feel you. I am full of these. Now my friends just sigh when I present them another contraption. the latest one was a fake md5 hasher that actually just encrypts so if your string is short enough, it keeps it aes ecrypted.",2
geox8uw,k6lt6t,"Don't give in to the idea that shitty ideas do not need to be executed. 

It can bring a lot of fun and learning. On top of that it's what makes you special.",2
gea81t6,k4hyqk,what is this language,11
gea92jy,k4hyqk,racism,41
gea942h,k4hyqk,sounds fun I'll check it out,9
geaahsh,k4hyqk,written by oracle,11
geaa8t4,k4hyqk,kotlin,5
geaavib,k4hyqk,I don't see the fun in OutsourcingSort,7
geab2v8,k4hyqk,"its fun to save a bit of money for a drop in quality 

- every pm ever",6
geclm3e,k4hyqk,"Here, have a downvote for a boring post",-2
gecngbb,k4hyqk,cool. have a downvote for this non insightful comment,2
ged0mtb,k4hyqk,Don't be disrespectful. It's you who did a low effort and boring post. Now it should be you who also pay the price.,-3
gedd912,k4hyqk,"huh dude? i cant tell if this is sarcasm or not. if not, then why is it that you can dish it out but dont want to take it also? just stop.",3
geclliy,k4hyqk,"Agree, very lame meme attempt",0
gecsd0b,k4hyqk,I thought this was going to be about using sleep calls and outsourcing the sort to the thread scheduler.,1
geclmn5,k4hyqk,Really boring.,-1
geb1f4a,k4hyqk,not funny,-6
gebynmc,k4hyqk,aight,4
ged0o18,k4hyqk,Agree,0
ge3738o,k3i9p7,I hate this but I love it,22
ge3bzcn,k3i9p7,"Lol, that seems to be the general consensus.",10
ge3d2n9,k3i9p7,This doesn't belong in this sub. This is actually awesome programming.,33
ge3d6wg,k3i9p7,"Well that's nice of you to say. thank you, I appreciate that.",11
ge3rl62,k3i9p7,Yeah it's a bit ... eccentric but here is to make fun of actually awful code ~~we write~~ our colleagues write.,7
ge4fo22,k3i9p7,"Maybe I'm just old, but these attention-grabbing ways of making videos are annoying. He does explain it just fine, though I would have personally liked a bit more detail. Personal opinion though, if this makes the kids interested in programming, then all good!",5
ge7o3d4,k3i9p7,"I understand where you're coming from. I'm trying to have a balance of education (explanation) and entertainment. But from my experience it's hard to please one or the other. On one hand, if I explain too much, it's harder to reach the general audience I want. And if I explain too little, the videos lacks the full picture (and for people like us who appreciate the ""science"" behind it, it lacks the science). I recently uploaded a video where I tried to do both better (explain + entertain) and it was a 26 minute video, which some might like, but the general consensus is that I ""explained too much"" even though I really tried to limit the explanation. The program itself is simple, but the most interesting part to me was explaining how I actually got the data (by reverse-engineering the Door Dash Private API). 

Incase you are interested: [Letting a PROGRAM decide what I EAT!](https://youtu.be/WPILHU3ERaU)

Edit: Also, I have had the younger crowd reach out to me privately asking questions about the programs I have been uploading, so I agree with you and I'm also glad that it's getting people at the very least interested in software dev.",1
ge53aub,k3i9p7,"Yes this is so good, unlike other tutorials I didn't fast forward this video.",3
ge3rcy0,k3i9p7,"Next iteration: sequence of 4 QRCodes, 1 in the red channel, 1 in green, 1 blue, and 1 encoded as C64 cassette beeps and bops.",9
ge4294i,k3i9p7,"you don't need a sequence of qr codes, you can just sum red, green, and blue codes into a single rgb frame. you can also be a bit more tricky and get an even higher bit depth",3
ge9wxx5,k3i9p7,"Having 1 QR Code per frame, for each channel, including audio, was the point of my joke -- or suggestion, depending how you much time you have on your hands lol.",1
ge4ffhk,k3i9p7,"I was thinking you could put a bit of error correction code in there to account for video compression, and basing that on QR codes makes sense. Just use as few pixels per block as is reliable.",1
ge3xzc2,k3i9p7,Now we just need a way to disguise this into a normal video and it will never be stopped.,6
ge41xzi,k3i9p7,"That's called steganography, and there are already tools for doing it.",8
ge5aa2w,k3i9p7,Are there tools for doing it in a YouTube video that circumvents any compression YouTube might be doing to an uploaded video? I'm pretty sure YouTube strips any meta/unused data from the video file you upload so I doubt steganography data would persist.,2
ge5e780,k3i9p7,"steganography involves embedding a message in another medium to conceal the fact that a message is even being transmitted. there are plenty of ways to do it that will work with a yt video. putting something in the metadata wouldn't really be steganography.

a rudimentary example would be using the lowest bit of the a, r, g, and b channels in a PNG image to encode some other bitstring. that gives you 4 bits per pixel in a lossless format.

since you use the least significant bit, the colours aren't really changed, so the image looks the same, but has a concealed message.",2
ge47jcl,k3i9p7,Now also make use of the sound lmao,4
ge4aoi3,k3i9p7,😂,1
ge3tbb6,k3i9p7,"Each pixel can store up to 268435455 numbers, and we're using it to store just 2 of them. Nice!",10
ge41u0r,k3i9p7,"ehh, no. if you're using the standard RGB32 color format, then each pixel can store 24 bits of useful information (8 bits are used for an alpha channel, which is not used in video formats).

the black/white approach changes the bit depth of pixels to 1, so its efficiency in some sense is 1/24. not ideal, but not as inefficient as you imply.

the problem is that the compression format for videos is lossy, so you need error correction techniques in your encoding format. so you could never achieve perfect efficiency with this technique. 

the black/white approach is a rudimentary error correcting code. we can definitely do better, but some form of error correction is definitely necessary",7
ge4aulm,k3i9p7,"I absolutely agree. When I first released the project, some people suggested using qr codes instead of single pixels. This way we can use the error correction already implemented by qr codes.",2
ge4mn06,k3i9p7,"sure, although a more optimal approach would  probably take advantage of the compression algorithm used for YouTube vids. I think they operate in Fourier space, so it may be less error prone to also encode information in fourier space. this can be done using opencv

not sure on the specifis though.",1
ge51w5w,k3i9p7,"I haven't heard of Fourier space before, that's definitely something I need to look into. That's what's cool about sharing projects, there is always someone more knowledgeable that has some really cool input. Thank you for sharing.",1
ge594wj,k3i9p7,"MPEG-4 specifically uses a discrete cosine transform. It's used to drop out high-frequency patterns in an images colours.

This means that encoding pixel-by-pixel would probably be a lot more error prone, since noisy patterns might get dropped by the compression algo.

You might have luck encoding data pixel by pixel up to some frequency threshold, then running an inverse, real-valued dft on a frame. that could make it robust against aggressive compression.",3
ge6hzby,k3i9p7,It’s probably not wise to be dependent on the internal optimization of a company known for over engineering shit,1
ge739ag,k3i9p7,? the DCT technique is a staple in image compression. its the core of JPEG and MPEG-4 frame compression,1
ge4iidi,k3i9p7,I believe that there are some video formats which do support an alpha channel but youtube probably doesn't support that anyway,1
ge5eg0z,k3i9p7,"it's actually moot, since mpeg-4 uses a completely different colorspace (Yuv)",1
ge45n6y,k3i9p7,"You could probably increase the information density of each frame by going beyond just two colors for squares. If you had maybe 32 or 64 different colors, you could match each square to the value of the closest color.

Alternatively, you could still encode the binary data just in the colors of the squares, but ignore the least significant bits of each square's color. So maybe just take the first 4 of the 8 bits used for each channel of the color in a certain spot, for instance. That would let the color change a certain amount before it starts affecting the important data bits.",3
ge4amx2,k3i9p7,Oh that's and interesting aproach. I didn't think of that.,2
ge5ek35,k3i9p7,"In general, this concept is called Hamming distance: the number of bit flips to convert one symbol into another.",3
ge4w23t,k3i9p7,"Compression might not only change the color values but could also introduce artifacts. The problem is that you cannot test this after uploading, since youtube might re-encode your video with lower quality a few years later. I have some very old videos on youtube that used to be high quality but now are only available in potato quality.",3
gdyovp1,k2za18,Wow you made a application that picks a random choice from a list of foods. Incredible.,3
gdyr5y8,k2za18,"lol, thanks :)",1
ge8va37,k2za18,"ah cool, you actually posted it here. I thought it'll get more upvotes tho...",1
ge8z1az,k2za18,"I'm glad you thought so, that counts for something.",1
gdz7uxs,k2xy4p,TL DR,10
gdzga6l,k2xy4p,Making coreutils in Python that you can contribute to,4
gdzti05,k2xy4p,What about programmers who are allergic to nuts ?,5
ge1xo9s,k2xy4p,"Hmmm, very interesting.",1
ge1maa6,k2xy4p,"This will be ultra slow, just saying",3
ge1x7ht,k2xy4p,"Yes, but Richard Stallman did not think that when he founded GNU. Then why should we,

If enough people contribute to this project then the development speed could be ultra fast.",2
ge218xw,k2xy4p,"I'm not talking about development speed but runtime performance

edit: just realised what sub we're on",7
ge0azgl,k2xy4p,"U want to make a file Explorer? Or is it some kind of terminal? 

I read a bit about gnu, but i dont get the big picture?",1
ge0qr97,k2xy4p,"The GNU Coreutils is a set of core utilities that almost every Linux system runs, containing programs like cat, yes and cp. Everything needed to interact with a Linux system",5
ge1xzak,k2xy4p,"Simplified: The GNU CoreUtils is a set of programs that are used to do basic tasks on the terminal.

The project is a bit more complex than that but It's okay as a synopses.",2
ge0qs5b,k2xy4p,I submitted an issue for you,1
ge2bkz1,k2xy4p,"Non-shitty programming project I've been following is https://github.com/uutils/coreutils

Coreutils in Rust AND cross-platform

If you're trying to learn that project is probably worth contributing to more",1
ge3q3jy,k2xy4p,"Nah mate, were doing it from scratch. *Also I don't know rust*",1
gdlsk63,k12rzo,What monsters saw this and did not upvote it?,81
gdm5qza,k12rzo,"https://stackoverflow.com/a/64921523/1516661

It now has 69 upvotes. Nobody touch it.",40
gdp7lvf,k12rzo,Pee pee poo poo,1
gdme1h3,k12rzo,"This is fucking beautiful. Does the choice of mantissa matter here? Can you not just do 1e-322?

Edit: does binary vs decimal cause the requirement? I can't seem to justify it, although I can kind of suspect where this is going",19
gdosxj7,k12rzo,"That value is chosen because it’s approx 2^-1071, which when you multiply some double precision float by it will shift that number into the “subnormal range”, which will start rounding off binary digits.  I’m sure in practice 10^-322 will work fine as well if you try it.",5
gdowvuz,k12rzo,"Ah thanks for the explanation. I suppose once the exponent is already at minimum, we start truncating the mantissa. Thanks.",1
gdoxj1z,k12rzo,"Exactly!  Once the exponent is at the lowest level we can start inserting zeros into the mantissa to get even smaller numbers, at the expense of losing digits of accuracy.",2
gdn2yhx,k12rzo,Simple maths. 1/1/1/1/1/1/1/1/1/1 is still one. Or am I being wooshed right now?,2
gdn5sce,k12rzo,"1e-322 is 0.000000...000322 , not 1/1/1/1...  So I’d go for whoosh :)

Edit: fuck knows why I put ‘322’ at the end. 1/(10^322) is what you’re after.",-7
gdn8ev4,k12rzo,"&gt;1e-322 is 0.000000...000322

Wrong, 1e-322 is 0.*&lt;321 zeros&gt;***1**",15
gdosurk,k12rzo,"Yep, you’re right - posted my response whilst multitasking, will leave it and bask in shame",1
gdnaogd,k12rzo,Wat? No! 1e-322 is 1 * 10^-322,6
gdosscf,k12rzo,"Yeah, you’re right - serves me right for post comments whilst busy",1
gdn7r8n,k12rzo,Oh sorry I'm being stupid,3
gdot46u,k12rzo,"We both are mate, we both are",1
gdo088f,k12rzo,"This is a two-liner to show how completely, ridiculously the whole web is fucked up.",9
gdmnep5,k12rzo,Subtract .5 (if necessary) and convert to an integer? Is this not possible in CSS?,2
gdn0a1c,k12rzo,No. There are no conditional statements or type conversions in CSS. It's not a programming language.,19
gdn0d3n,k12rzo,*sad Turing machine noises*,20
gdn3hrx,k12rzo,"But calc always rounds up. So subtracting .5 for proper rounding, or 1 for flooring works for non-integers.",6
ge1zqfz,k12rzo,madlad,1
gdmtm5c,k12rzo,"What's the ""third decimal point""? Don't numbers usually have at most one?",-1
gdmw2mg,k12rzo,I think they mean the third digit after the decimal point,12
gdmxf51,k12rzo,Would've helped if they wrote that then...,-5
gdgki2h,k00wi2,"this... seems like a reasonable comment describing non-obvious behavior which prevents a bug from a chunk of well-tested, well-documented code? what’s the joke here",150
gdgl5ai,k00wi2,"&gt;cJSON

I think is the fact that you have to do it in order to safely use this library",56
gdh4jhv,k00wi2,That's bits odd. Won't lie. But all in all cJSON is a pretty good library. Works well in embedded applications too.,12
gdhshtg,k00wi2,Ambiguous memory requirements and embedded applications seldom go hand in hand.,20
gdikxvq,k00wi2,"If such ""ambiguous memory requirements"" are not acceptable, json has no place in an application.",4
gdiz59j,k00wi2,It's not ambiguous. It's X+5 ;),4
gdjjx6d,k00wi2,"I know you're being cheeky, but if it's not in the API then there's no way I'm trusting a fudge factor.",2
gdj7aub,k00wi2,Next you're going to be telling me that I can't put a Java runtime environment on my car's airbag ECU. Where does this slippery slope end?,1
gdl7fqm,k00wi2,"It's not just a bit odd, it's 40 bits odd.",1
gdmgmgt,k00wi2,👈😎👈,1
gdgipsx,k00wi2,"Or 50 more to be *really* safe.

But to be fair, I think cJSON does a pretty good job and I'm happy to allocate 5 extra bytes if it reduces complexity.",52
gdgph4s,k00wi2,You know 5 bytes is safe if they even included a fuzzer as part of their testsuite,8
gdh3gye,k00wi2,"I do this a lot, usually with 2 bytes.   Never know when you're going to make an off by one error.

I'm also a fan or rounding up to some block size, or just always allocating the max, so you don't get as many random different sized blocks fragmenting the heap.",19
gdj8xi4,k00wi2,"You, and your compiler too. IIRC C/C++ shorts store two bytes of data but allocate 4? Just an example. Stuff like this isn’t really bad code, it’s just that in almost all use cases you don’t care anymore about a couple of bytes, and there is only so much time in a developer’s day to fix small issues. 


Honestly I wish more of the r/shittyprogramming stuff posted here had to do with incorrect application (oh hey I tried implementing design pattern X, but there was an unexpected consequence type of thing), rather than just “Look guys, my teacher made a typo on one of fifty assignments”, or “oh my god, a byte is being wasted, CAN YOU BELIEVE IT?” 

Just honestly, like, who even cares?",2
gdjcqip,k00wi2,"It's not bad code because it's wasting 5 bytes, it's bad code because the library is wrong about how many bytes it actually needs, and how do you *know* 5 bytes is enough?",3
gdji9k1,k00wi2,"You’d have to ask the dev how they know the 5 extra bytes is enough. My guess? They probably measured how much they might be off by, and determined it was at most 5 bytes.",3
gdjmsn3,k00wi2,"If that's the case then they can just add 5 bytes to their own estimate and then the library is memory safe. Tbf the whole note is confusing - I don't think it's about memory-safety at all, given that the buffer length is an argument. Also I would discourage this kind of reasoning in critical applications!",1
gdj8yag,k00wi2,"Here's a sneak peek of /r/badcode using the [top posts](https://np.reddit.com/r/badcode/top/?sort=top&amp;t=year) of the year!

\#1: [I mean, it's O(1) so who cares?](https://i.redd.it/mt30oxcitr851.png) | [114 comments](https://np.reddit.com/r/badcode/comments/hkxndd/i_mean_its_o1_so_who_cares/)  
\#2: [The teacher didn't like my O(1) Fibonacci implementation...](https://i.redd.it/tzg6lyx0rza51.png) | [186 comments](https://np.reddit.com/r/badcode/comments/hrkm5t/the_teacher_didnt_like_my_o1_fibonacci/)  
\#3: [Very innovative approach by 8yo me. What do all negative numbers have in common?](https://i.redd.it/4ximf9f0no251.png) | [165 comments](https://np.reddit.com/r/badcode/comments/gvsfln/very_innovative_approach_by_8yo_me_what_do_all/)

----
^^I'm ^^a ^^bot, ^^beep ^^boop ^^| ^^Downvote ^^to ^^remove ^^| [^^Contact ^^me](https://www.reddit.com/message/compose/?to=sneakpeekbot) ^^| [^^Info](https://np.reddit.com/r/sneakpeekbot/) ^^| [^^Opt-out](https://np.reddit.com/r/sneakpeekbot/comments/joo7mb/blacklist_viii/)",1
gdjkrbo,k00wi2,"&gt;You, and your compiler too. IIRC C/C++ shorts store two bytes of data but allocate 4?

I don't think is true. There are alignment requirements in most CPUs so you may have unusable padding bytes in some cases - but this is for speed, not for safety.",1
gdjl6l8,k00wi2,"You may be right. That said the point still stands insofar that it will allocate enough bytes for the maximum possible value, whether you’re storing that value or not. Memory at the byte level is constantly wasted in some way",1
gdjorlo,k00wi2,"You're right, but I don't consider this a problem of wasted bytes - this is a problem of poorly-specified functionality wrt. memory.

From an information POV, these are different problems. The reason the compiler must allocate the full size of a numeric type for a variable is because the size must be decided by function run-time AND the variable must support the full range of values at run-time, since a) C compilers don't have to capability to statically infer the used ranges of variables and b) the value may depend in some way on external info, which is impossible to statically analyze anyway.

However a program/function with ambiguous semantics (especially if it's about memory-safety, which may or may not be the case here) is definitely something that can be improved!",1
gdjrp8k,k00wi2,"That’s true. I’m mostly being a bit defensive of the code here because I’ve experienced some similar peculiarities when working with Unicode and ASCII conversion in C++ recently. Storing c++ wide string in 7-bit narrow c++ strings for example often leads to a longer string than the original (for escaped format characters and stuff like that), and the exact byte size of the underlying wide char isn’t even standardized across systems, so I would assume similar issues may tie into the estimation problem here as well. It’s easy to look at the function and say “oh well that’s shitty programming”, but in the end none of us are really gonna go fix it ourselves either 🤷‍♂️

I do agree that there’s room for improvement though!",1
gdhujed,k00wi2,"This seems like a terrible idea. It doesn't understand the reason and mechanism are understood at all (if they are, the comment should link to an explanation or bug ID or something). If it is wrong by 2 bytes, who's to say it isn't, particularly in maliciously crafted examples, wrong by 2,000 bytes? If you don't understand why it is sometimes wrong, it is a bug you need to track down, understand, and then allocate exactly the amount really needed. Just adding 5 bytes and hoping that will be enough is not a good idea.",10
gdjnwix,k00wi2,"The note is really confusing. How does the user know how many bytes they might need anyway? And why does cJSON need to estimate anything?

It makes me think it's not about memory safety at all - my guess is that they check the estimate against the buffer length as an optimisation, to fail early before serialising much. If the estimate passes then serialisation is performed, returning a bool of whether it is truncated according to the buffer length argument. This means that the estimate can only be under and not over, in which case it might be fine? Or maybe the function returns true if the estimate passes, regardless of truncation, and so the extra 5 bytes is to ensure the data is a complete?

Overall very confusing documentation!",2
gdi705y,k00wi2,"Cool font, btw",1
gdfwa8i,k00wi2,Lol,2
gdgaeuq,k00wi2,Lel,0
gdd5nlr,jzn12d,Huh. I thought the app store wouldn’t allow something like this.,37
gdd5uzk,jzn12d,"I don't know, maybe it's sandboxed or something?  I've no idea about the app itself.",24
gddwldk,jzn12d,"I don't know how this one works, but there have been projects that allow you to run arbitrary Python and Lua code for a long time.  What they don't allow is \*downloading\* arbitrary code.  So you can type (or paste) all the code you want in those apps, but they are (were?) prohibited from going out and downloading code.

Actual compilers to native code seem like they'd be harder to get past Apple, but maybe this is just a wrapper around a web service or something where it's not actually running on-device at all?",13
gdedrzn,jzn12d,I just installed and tried it and nothing is working without an internet connection. So I guess it isn’t local compiling anything and just sends it to some server that returns its stdout,8
gdgl7s8,jzn12d,Reminds me of that time a guy did a talk about how PowerPoint is a programming language and should be banned from the Appstore,3
gdd854d,jzn12d,"Ahahahahahahaha this is exactly what I needed. I hope that review gets taken down though, it’s unfair to the developers.",18
gde2qi7,jzn12d,"Unless he just missed the '#' when he was selecting the code to copy, and it really did fail to compile perfectly good code. Not by any means a given though.",7
gdya4yi,jzn12d,"I worked for a company that made children book apps. One review said audio didnt work. What was the problem? the user's volume was literally 0. Did the user remove the 1 star after we helped them out? hahahahhaha

Some reviewers are just that stupid",1
gde30eg,jzn12d,"""In app purchases""",6
gde4f00,jzn12d,Just 99 cents for each #!,8
gde6ai8,jzn12d,"This is c++, not python. In c++ you pay for each pointer.",6
gdemt5q,jzn12d,"&gt; In c++ you pay for each ~~pointer~~ semi-colon.

ftfy",-1
gdeylts,jzn12d,Bad bot,3
gdeymgv,jzn12d,"Thank you, MeLoveSigmundsdottir, for voting on Athandreyal.

This bot wants to find the best and worst bots on Reddit. [You can view results here](https://botrank.pastimes.eu/).

***

^(Even if I don't reply to your comment, I'm still listening for votes. Check the webpage to see if your vote registered!)",2
gdeyn43,jzn12d,"Are you sure about that? Because I am 99.99998% sure that Athandreyal is not a bot.

---

^(I am a neural network being trained to detect spammers | Summon me with !isbot &lt;username&gt; |) ^(/r/spambotdetector |) [^(Optout)](https://www.reddit.com/message/compose?to=whynotcollegeboard&amp;subject=!optout&amp;message=!optout) ^(|) [^(Original Github)](https://github.com/SM-Wistful/BotDetection-Algorithm)",1
gddum1l,jzn12d,This guy has a lot to learn...,2
gdffpo3,jzn12d,"Maybe that apps need a forum discussion for asking that  


""Oh you have tried 5 times and still error, ask our community for help.  
Try our premium membership! for 7 days""   


Hhahaha",1
gdg4x3s,jzn12d,Is this even a real person,1
gdyaaqz,jzn12d,anger translator: Learn to code you dumbass!,1
gdal2pr,jz02ql,This was very cool thanks for sharing!,4
