comment_id,post_id,comment,upvotes
g66sjj2,iwv0f8,"I am thinking of going epycs or dual xeons for 128 lanes or 96 lanes.  Kinda given up on the idea of running gpus in case and on motherboard, so I will be using a mining case/ chasis to house 2x 1200w PSU and using extenders/ risers for cards. This is be easier to set up for air cooling.  Having 4x 300W+ gpu is like turning on my electric kettle(1400w) all day.  I cant even imagine water cooling it.  Cooling will be a bit easier on air and in an open air chasis.  

The problem with threadrippers are that there just isnt quite enough pcie lanes and there are no 1900x cheapo TRs anymore.  Although 8x pcie 4 ~ 16pcie 3, running 8x on TRX40 is not really a problem.  I am looking at getting dual epycs or dual xeon, and you can get 8x pcie16 motherboards with dual cpu, since I am running risers, it will be trivial to change a 4x gpu system to 8x gpu.   A bonus of running epycs and xeons is that there are a lot of data-center leftovers right now.  xeon platinum and ddr4 16gb ecc rams are quite cheap right now, so I might be heading in that direction for a ""value"" 96 pcie lanes, tho its will be pcie 3.0.

I am having the exact same concerns with current configurations of motherboard/ cpu to running 3 slot gpus.  There is a gigabyte 3090 blower coming out, but I really doubt it will cool 350W in a dual slot blower design.  If I am buying new, my specs are probably the same/ close  as yours, SP3 ROMED8-2T +AMD EPYC Rome 7232P+ 256gb to 512gb ram + space for 7x gpus",1.0
g67eowy,iwv0f8,"Same here. I am also going for a mining rig and full on air cooling. Open air cooling performs almost as good as liquid cooling.

Epyc setups are indeed much better for future expansion.

Thanks for your input.",1.0
g62vney,iwslx6,"Read Goodfellow's book and start reading papers. You need a good theoretical foundation to know what will work and a good imagination to get an idea of what might work.

Generally all architectures are improvements over their counterparts that didn't do the job well. MLPs are an improvement from a single layer perceptron with a shiny new nonlinear activation. CNNs are MLPs that can detect patterns locally. Resnets are very deep CNNs that use residual connections to fix the vanishing gradient problem. RNNs are MLPs that can process sequences well. Transformers are MLPs that can process sequences without recurrence in a GNN-like way. GNNs are MLPs that can work with graphs. All of these are improvements over something that didn't work well at the time.",7.0
g63dfh0,iwslx6,Thank You...I will start with the book and when I feel confident enough try to improve some old architecture which hopefully improve my insight,2.0
g62uqmh,iwslx6,"I've struggled with this myself. Implementing a known architecture? Easy. Understanding what of that architecture works well for it? Also easy. Understanding all the bits and pieces and their purpose? Also not too hard. Building my own model architecture and improving on what is currently available is extremely difficult. People get paid a lot money and earn a lot of prestiges for doing so. I try to deeply understand why one type of model woks the way it does, then think how to improve it, and run as many experiments as I can to see what works. Then in the end the baseline model still arguably outperforms mine. I have no idea honestly",4.0
g62v3v3,iwslx6,"I have designed my own before and here's how you can too;

1) pick an existing architecture that is generally used to solve the problem.

2) LEARN EVERYTHING ABOUT IT IN AS MUCH DETAIL AS POSSIBLE.

3) try to do it on paper (understanding the math) to see how the input transforms into the output step by step. You can use small dummy values and variables.

4) meditate over the process and see how you can improve it.

5) talk to experts. Doesn't have to be ML people, I've found people good at data structures and algorithm can provide good insights to ML problems.

6) keep thinking about it while doing other menial tasks.

7) hope lol

Note: when making new architecture I'd recommend using pytorch over tf and keras. Keras works best for basic models but if you wanna create something brand new it's a pain.",6.0
g63ddk3,iwslx6,"As stated in other comments, read papers to know which methods work and which do not.

But to be fair I think building a deep learning architure is a lot of wild guesses based on intuition (therefore not necessarily rational).

A teacher of mine once told me that Google deep learning engineers often test a lot of ""random"" architectures at the same time and write a paper about the one that performed the best. Given the fact that they practically don't have any limit in computer power, they have the luxury to do such a thing when smaller labs cannot. Is it true or just a bit of jealousy I couldn't tell, but in my experience DL architectures are often, indeed, a random guess that worked on the test set.",2.0
g62nwui,iwslx6,fastai,-1.0
g62taue,iwslx6,Im not looking for modules or APIs to make my own models..Im looking to learning how to plan and go about designing an architecture...,2.0
g63h6yk,iwslx6,Terrible APIs,1.0
g60xz9t,iwkrfm,"You would need a really big computer to do that by backpropagation, remember that in bp you  must instantiate the whole model on parallel instances and make a layerwise weight correction. Maybe for probabilistic models or by using other training algorithm that allows to reduce the dimensionality of the network there couls be benefits.",3.0
g62mye4,iwkrfm,"Not backprop,  but RBM-style models can benefit a lot from specific types of computers called quantum annealers as mdoels are well aligned to quantum process",3.0
g618fek,iwkrfm,MIT &amp; IBM did [a study](https://www.nature.com/articles/s41586-019-0980-2) where it was shown that supervised learning performs better than on Classical Computing.,2.0
g60ta2v,iwkrfm,"No one knows the answer yet.

Or maybe everybody knows, I just haven't looked into it deep enough.",3.0
g61i4o8,iwkrfm,"To add, it would probably be better. It'w hypothesized that in order for the network to work well, it has to have good data flow. Among other things, what's needed for good data flow is reversibility. Given that quantum operations are reversible because they do not destroy information, a quantum layer would have such a property. But there are many other problems before we get there from what I understand.",1.0
g61iz1d,iwk50x,"This is pretty neat! But I must ask, why does this have to be done with a neural net? Aren’t there algorithms that can do this much faster?",3.0
g61k7g0,iwk50x,"Yes it can be done procedurally, but that is normally based in perlin noise and similar technics which ends up looking randomly generated and not realistic. A terrain model created by an artist generally looks better and less random. A neural network has the potential of learning from that and generate terrains of similar quality.",4.0
g61xbpz,iwk50x,Ah I see. Thanks for the explanation! :) they do look great indeed!,1.0
g61eks8,iwk50x,What does epochs mean here? Is the model supposed to simulate geologi movements and erosion?,3.0
g61gz9j,iwk50x,"As u/nmkd already said, epochs represent the times the entire training dataset was processed.

The model is supposed to generate new terrain 3d models, because the models used for training already have the results of erosion and sedimentation modeled, it is supposed to learn that too.",2.0
g61evlp,iwk50x,"Epoch is an ML term.

One epoch = The training dataset was processed once.",1.0
g60m6dx,iwk50x,ML Terraform is a Neural Network Terrain Generator trained on handmade 3D models. More details at: [https://apseren.com/mlterraform/](https://apseren.com/mlterraform/),1.0
g648p7z,iwk50x,"This is really cool. I have two questions:

What does the ""DC"" in DCGAN stand for? (Forgive my ignorance!)

What do you see as some of the potential applications of artificially generated terrain? Are there any specific corners of industry who have signalled a genuine interest in this innovation?",1.0
g64kvy0,iwk50x,"DC stands for Deep Convolutional.

In the field of game development in particular, terrain generators are quite used and the ones that do it procedurally and completely without the artist intervention (no stamps) produce very random looking results. Some indie developers in particular would prefer to focus on the programming part and use a more automated tool to generate the scenarios instead of having to learn and get proficient in terrain 3d modeling.",1.0
g64rd4m,iwk50x,"That's interesting, thanks for the response. 

I wonder as well if you might find some interest in the geoscience community. In the past I have studied flood inundation modelling.  One of the aspects of that and also other earth sciences (such as landslide modelling) which garners interest is the fabrication of large synthetic datasets. These allow you to understand what permutations of features have more proclivity towards flooding and similar hazardous processes. This might be an area you would find interest from users.",1.0
g6532yc,iwk50x,"Thank you for the suggestion, seems an interesting idea. I think the difficulty of that would be to get good datasets of floods and landslides. Do you know any?",1.0
g68yfrs,iwk50x,"If you go on Google Scholar and search for ""Global/Continental Flooding/Landslide datasets"", I am almost certain you will find some papers of interest. There might not be open source datasets but you will find the academics who are the gatekeepers of that data and they're normally quite open to collaboration.",2.0
g68ydlj,iwk50x,"If you go on Google Scholar and search for ""Global/Continental Flooding/Landslide datasets"", I am almost certain you will find some papers of interest. There might not be open source datasets but you will find the academics who are the gatekeepers of that data and they're normally quite open to collaboration.",1.0
g6arszs,iwk50x,"Cool works!! 3D GANs seems still in its infancy and your works look promising. Definitely would follow your works more.

May I ask a bit about the model? What kind of 3D model inputs/outputs you used (like a pointcloud or mesh models)? And do you require any special NN architecture for it? 

I’ve had random ideas to use arch. like PointNet which geared for 3D pointcloud for generative purpose, though haven’t actually put the time to experiment with it haha.",1.0
g6c2ekc,iwk50x,"Thank you. The model is a regular DCGAN with some modifications, I have experimented with other architectures but had worse results, complexity generally is not desirable if you do not have the infrastructure to train a large model. The dataset was converted to a point cloud with color information per point.",1.0
g6dtsse,iwk50x,"Ah I see, thank you. Keep up the good work!",1.0
g62c1y3,iwfcm1,Watching Obama turn into Trump was the stuff of nightmares,1.0
g63wyqh,iwfcm1,Sorry 🙂,2.0
g64kqb4,iwfcm1,Code?,1.0
g5zmis7,iwczxf,"Resnet + squeeze and excitation, efficienet is good on paper but slow when trained",1.0
g5zo7u7,iwczxf,What are squeeze and excitation? Are these augmentation techniques? Any papers I could read?,3.0
g605wez,iwczxf,"Its not an augmentation technique. It just a normal CNN with extra layer which happen to weigh each conv layer. It supposedly captures the global dependencies. Although I've personally trained it, and it could't outperform ResNet for what I was using it for.",2.0
g63hu1a,iwczxf,"Man resnet with se outperforms vanilla resnter, they show the results in the paper. It is an attention technique",1.0
g5zr3a3,iwczxf,does Resnet perform better than vgg? particularly vgg 19?,3.0
g609pe4,iwczxf,"Absolutely. [https://www.researchgate.net/profile/Frank\_Koss/publication/320084139/figure/fig2/AS:543716588744704@1506643544031/Comparison-of-popular-CNN-architectures-The-vertical-axis-shows-top-1-accuracy-on.png](https://www.researchgate.net/profile/Frank_Koss/publication/320084139/figure/fig2/AS:543716588744704@1506643544031/Comparison-of-popular-CNN-architectures-The-vertical-axis-shows-top-1-accuracy-on.png)

This picture only shows performance on imagenet but the results will likely be similar for your application and the efficiennet paper has a similar graph.  Models without residual connections usually get worse once you start adding a large amount of layers, usually \~16 depending on what layer types you're using because of the vanishing gradient problem.  You'll often see VGG16 perform better than VGG19 on several datasets.  With resnets you'll effectively sidestep that problem and you can always go deeper.",1.0
g61l9br,iwczxf,"For SOTA check out PapersWithCode, they're great for beginners and will usually lead you to the implementations of the networks you're looking for.

As far as I know, resnets and retinanets are the kings of anything face related.",1.0
g5yuezb,iwcp5m," Project page (paper &amp; code coming soon, as per the authors): [https://research.cs.cornell.edu/crowdplenoptic/](https://research.cs.cornell.edu/crowdplenoptic/)",1.0
g5yqek1,iwbxqe,"Depends on what language you’re using, but there’s plenty of guides on running a python app in Flask, and then making an API that you can query for predictions.",2.0
g5yqhra,iwbxqe,Yeah I use python,1.0
g5zne6d,iwbxqe,Streamlit,2.0
g5ydtb3,iw9y4o,"I'm also i want to build an object detection model using YOLO.
But I think if you build it from scratch it will be very difficult (its model simple like any CNN model).
I'm a beginner in this field and i'm trying to read as much as possible of articles to understand what really Yolo is.
If we have any simple idea we can work together.
Thank you",1.0
g5zhfkx,iw9y4o,"Not exactly object detection, but segmentation made easy and explained line by line here: [https://www.youtube.com/playlist?list=PLZsOBAyNTZwYuFfht61R0b-N1TNIX5\_Vy](https://www.youtube.com/playlist?list=PLZsOBAyNTZwYuFfht61R0b-N1TNIX5_Vy)

Tensorflow object detection API is easier for object detection because of scripts: [https://tensorflow-object-detection-api-tutorial.readthedocs.io/en/latest/](https://tensorflow-object-detection-api-tutorial.readthedocs.io/en/latest/)",1.0
g5xwmth,iw7uuy,"*Beep boop*

I am a bot that sniffs out spammers, and this smells like spam.

At least 100.0% out of the 9 submissions from /u/samboylansajous appear to be for courses, coupons, and things like affiliate marketing links.

Don't let spam take over Reddit! Throw it out!

*Bee bop*",19.0
g5y6ekm,iw7uuy,Haven't checked the actual content yet but very well done! Most deep learning courses guide the student to training the model but not how to deploy the model to a real use case. Your niche on bringing the AI to Flutter App is cool!,3.0
g5xsaov,iw7uuy,Thanks a lot for make it free!,2.0
g5yfae9,iw7uuy,"i dont know flutter, do i need to learn it first before this course?",1.0
g5ys30p,iw7uuy,"Knowing some flutter would be helpful! But if you knew OOP, you would be fine!",1.0
g61b2ra,iw7uuy,Thank you !,1.0
g8oa9wt,iw7uuy,"Thanks so much for sharing the course! Is the coupon code still active, or did I miss out :(",1.0
g5y5bi3,iw7uuy,"I was trying to start flutter deep learning, it will be a good start I guess. Those NNs are good choice.",-4.0
g5zb9g2,iw7uuy,why the hell I got downvoted.,1.0
g5utn84,ivzbug,You have posted this every day for the past three days...,3.0
g5t5lvy,ivp8y0,What classifies someone as a beginner vs intermediate?,5.0
g5t7tiu,ivp8y0,"Not sure how to answer that one in an exact manner but let me try. 

If you know Python and how to search for stuff on your own (Proficient at Google lets call it that way 😂) these projects are considered to be beginner level (especially MNIST classification). There are many step by step tutorials out there just google it. 

The idea here was to give you some rough guidelines but not to explain exactly how to do it.

MNIST classification using off-the-shelf models can be done im 50 lines of code if you search it up. Like query ""MNIST classification in PyTorch.""

Intermediate is somebody who has done all of these. 😅

Hope that helps!",3.0
g5tjfz0,ivp8y0,Please tell me it wasn't too hard. If you have any feedback for me it's super appreciated!,1.0
g5urkue,ivp8y0,I still need to go through it in more depth although I was just asking out of curiosity! I have been a full-time python SWE with ML for 3 years but haven't touched neural networks yet really at all so I am planning to start a side project soon for fun.,3.0
g5utj1s,ivp8y0,"Awesome glad to hear that! Now I get your question, unfortunately the word beginner is overloaded (in the C++ sense of the word 😅).

These are not ""beginner"" in the sense you're new to programming altogether, more of a beginner in deep learning and you want to gain some confidence before you start tackling some harder problems. So they could still be of use to you!",3.0
g5uuxoq,ivp8y0,Perfect! Appreciate the responses,2.0
g5uv4rg,ivp8y0,You're welcome!,1.0
g5srff4,ivp8y0,\*still NOT an ex-Google engineer. If you have any questions I'll be monitoring the post!,3.0
g5ssqmp,ivp8y0,"soon to be ex google engineer😂! Have you been using PyTorch from the very beginning, or you migrated from Tensorflow? And what do you think about Tensorflow 2?",3.0
g5st28p,ivp8y0,"Hahahaha If I say that then I'll soon become an ex-Microsoft engineer and not by my will! 😂

Noup, I was using Keras and TF in the beginning. I was less knowledgeable back then so it does not count as much. 😅

All of my more serious ML projects I've done in PyTorch. But it's super easy to switch especially if you know ML.

Here is what I think about TF vs PyTorch:
https://youtu.be/NuJB-RjhMH4",3.0
g5sirzr,ivn79x,"It is hard to answer without having more details. Let’s go step by step.
Do you need AWS? Depends if you have a decent server on your own you don’t need it. A machine with a couple of GPUs with 8+ GB each should be enough for your problem.
You have to use a pretrained model, it would be stupid to start from scratch. No matter the task, you can always import weights from another model.
Definitely use an existing python library, I suggest pytorch. Forget tensorflow and Keras, unless you need to deploy to mobile. Nevertheless, everything you need was already implemented, it’s just a matter of putting the code together and write a data loader specific for your data.",1.0
g5t8uto,ivn79x,"This seems one sided. 

While pretraining is often valuable, it may not be in some contexts ( imagenet was trained on things at a local scale, medical content / 3d content / content from aerial / microscopic content plays with different rules ). You should explore with and without. If you have 1 mil images, and your time is more valuable than figuring out how to pretrain, just let it run longer ( no harm ).

Keras/tf2 is super easy to start with, and honestly has magnitudes of more examples than pytorch. I learned on keras to start, and i still feel pure tf is too much for me and pytorch looks like a globby mess ( IMHO ). I like keras in the way that it forces you to "" think of your layers "", and then it becomes a model.

You don't need multiple GPUs or a cloud account some where. If you have an nvidia card you are already in great shape, if not it's still ok to run on your desktop ( it will just take 10* longer ). But check out Google or Kaggle they both offer free use of their hardware on a juniper like interface. 1mil images wouldn't exhaust your training time per week.

I really recommend visiting keras-io or keras github pages. There are basically methods to do image classification prebaked for you ( some using pretraining too ). Copy that code and your images over to colab and bingobango.",4.0
g670um8,ivn79x,"How much of an advantage, in terms of time, does using a pre-trained model have over creating a model from scratch? 

Thanks for the insight on Keras and tf. So the issue we're facing in hiring rn is that the companies we are trying to partner with to create this solution, are quoting exorbitant rates and time periods. My question here is, with my understanding of IR and ML, this sort of a solution, should not take too much time correct and the cost of developing this shouldn't be very high either right? Or is my understanding on this wrong?",1.0
g678c79,ivn79x,"Well I personally advocate in house solutions always. The second you are willing to sub, then you are talking about overhead with such a solution. 

The sub is probably going to offer pretraining and that gives hefty price tag for validation of claims. It also reduces time of training down significantly. I would be less interested in how long it would take and more interested in what the classification / loss rate is. This is probably where you ought to be interested.

If you are thinking of this as a bid perspective: ask for a ratio of validation accuracy / time to completion and then what is that worth to you.

Is finishing the project tomorrow, next week, one year worth X,Y,Z dollars.. extrapolate.

Is finishing within 50%,75%,90%,or 99.99999% feasible for a solution?",1.0
g67azwr,ivn79x,Thank you!,1.0
g5sldre,ivn79x,"Would using a pre-trained model essentially mean that I would have to use transfer learning and customise it for my need?

I do require it to be deployed on a mobile, so would you suggest Keras/Tensorflow? Any reasons why to choose one over the other?

All in all, is it relatively safe to conclude that developing such a model should not take very long?

Edit - Should I consider making use of OpenCV as well?",1.0
g5soms8,ivn79x,"1. Yes, use transfer learning to avoid training from scratch and save time. It has been proven that on the long run it does not improve performances when your training set is big enough, but it can lower the training time from a week to a day.
2. I am not an expert on mobile development. What I know is that since tensorflow is developed by google, they provide several API for mobile development since they are in that business. Pytorch is developed by facebook which doesn't care about mobile for now. If you develop an app using Flutter, which is also developed by google, it has a native integration with tensorflow. Forget Keras, that's just a toy. 
3. Yes, it's quite standard nowadays and honestly, you could do it yourself without any programming experience by using tools like AWS CustomLabels or Google cloud AutoML(?). However, these tools are relatively new and expensive. I suggest to ask a freelancer who can guide you through the process and suggest you a solution in case the model does not reach the required performances.",1.0
g5rxqmz,ivjuv5,"If you have control of the annotation task, then annotate both the bikes and their riders. Then you can detect both. If not, then it sort of depends on the goal of your model. Do you really need to know where all exposed people are for safety reasons? Does your model not drive a vehicle or something that needs the context and information provided by knowing someone is riding a bike? Then just treat them as the same class as person.",1.0
g5s3aew,ivjuv5,it's an analytics model. No being used for driving. But the goal is to get better accuracy for all 3 classes.,1.0
g5qucd6,iv7xct,I'm so excited to use this once I get a new GPU,1.0
g5puo4r,iv3rnz,"Yes, GPT-3 is a better chatbot. It is trained on a much deeper corpus and, in effect, uses longer Markov chains, and has more capacity to refer back to previous keywords. But since the underlying logic has not changed, GPT-3 has all of the same problems as the thousands of predecessor chatbots.

All chatbots are impressive for the first (x) seconds or (y) sentences, at which point the narrative loses coherence and you see that there's no logic or direction, it's just babbling. GPT-3 increases (x) and (y) over GPT-2, which also increased (x) and (y) over earlier iterations - but the mechanics and results have not changed.

But there is one part of GPT-3 that *is* technically impressive and an advance in the field: its ability to model language at a basic level.

Past chatbots had serious issues producing valid sentences, because concatenating sentences based on overlapping fragments is a clever parlor trick but inadequate for real communication. If you staple together parts of the sentence: ""the dog had a bone in its mouth"" and ""a bone in my foot is broken,"" you get ""the dog had a bone in my foot is broken,"" which doesn't scan. GPT-3 produces surprisingly few of those gobbledygook sentences, which raises the prospect that deep learning may be capable of modeling the mechanics of writing.

That is an interesting result, and one that we've seen repeatedly in the story of deep learning: In tasks such as computer vision, speech recognition, and walking models for bipedal robots, the best deep learning models qualitatively outperform the best hand-coded algorithms.

So, yes, GPT-3 does not move us closer to artificial general intelligence. Unscripted machine-learning conversational models still cannot conduct meaningful discussions, even about simple topics like the weather. But GPT-3 raises a new prospect that *if* we can find ways of modeling the *underlying semantics* of intelligent conversation, then we may be able to use algorithms like GPT-3 to generate expressions in the recipient's language.

Also, dividing up the problem that way provides a promising advance for universal translation.",12.0
g5oze26,iv3rnz,Of course we have all seen plenty of human writing that didn’t evidence thinking either.,25.0
g5p2p9p,iv3rnz,deep,6.0
g5ps3iu,iv3rnz,Variational,7.0
g5r2qyv,iv3rnz,Auto,5.0
g5r38i1,iv3rnz,Bahn,8.0
