comment_id,post_id,comment,upvotes
g4dbgkf,in4f8s,"I guess PCIE4 data transmission might be a bottleneck mostly in case you're parallelizing and not using NVLink, or your architecture is smallish and you feed tons of data constantly. Otherwise it probably shouldn't. Not with the new on-GPU DALI decoder [https://docs.nvidia.com/deeplearning/dali/user-guide/docs/](https://docs.nvidia.com/deeplearning/dali/user-guide/docs/)

That depends on what you're training, though, of course.",1.0
g6y7kqa,in4f8s,yes. about x2 it seems,1.0
g6y7jbz,in4f8s,well looks like the 3090 is x2 the V100 on most DL work loads.,1.0
g6yfmrq,in4f8s,"Lol, how exactly did you find that? Very much depending on the exact network it's going to be either up to 2x worse - if heavy on FLOPS, or on par with Titan RTX which is slower than V100. At least until we trainsition to sparse kernels or something, where it might get a 2x boost or something. 30xx series has it's FP16 perf trimmed 2x for NVidia's market segmentation purposes.

&amp;#x200B;

Edit: No, it seems, actually, much less than 2x boost from sparsity, currently 1.3-1.8 depending on math intensity according to NVidia's numbers.",1.0
g6yqr0b,in4f8s,True. I ran a DLPerf benchmark and it scored 40 vs 20 for the V100. Same as wats used on vast.ai,1.0
g73c0dg,in4f8s,"If that is for FP32 then yeah, might as well be 2x V100. But it makes no sense to train in FP32 on anything newer than Pascal GPUs.",1.0
g75z4ok,in4f8s,That is interesting and very true.,2.0
g6gc3w8,in4f8s,"If you want to be safe next lets say 5 years using top of the line DL technology and not going to purchase titan lineup, I think 3090 is the only option.

Some famous Image model like VGG, NLP requires at least 8gig yet as standart, but if you're researcher who wants quick train test (assume you have organization and also have decent gpu server) I think in few years, the standard is going to get higher, even faster because nvidia's pushing it. Even some image model like mask-rcnn requires 12gig already to have decent generalize performance.

However I think 3090, It's not going to replace Titan lineup. Titan RTX has 576 tensor core where 3090 has 328 even if it's past gen. As good comparison. Next titan (If there will be one) is going to be better in purpose of deep learning.",1.0
g6gcuk1,in4f8s,"I am not sure Nvidia is releasing a Titan. 3080 super might be an alternative with 20GB but I don’t know when that’ll be released and if it will support nvlink. I am waiting for benchmarks, if they show less than 1.5 improvement over 2080ti, I’ll probably go for 2x 2080 ti.",1.0
g6gix9b,in4f8s,"As far as I know, Nvlink is not must for parallelize deeplearning workload with consumer-grade gpus. About 10% improvement over non Nvlinked gpus in famous image models, according to this post. enterprise-grade gpus scales better with nvlink.

  
[https://timdettmers.com/2020/09/07/which-gpu-for-deep-learning/](https://timdettmers.com/2020/09/07/which-gpu-for-deep-learning/)

This post has Super deep analysis with case by case use cases including gpu clustering.",1.0
g6i6qz3,in4f8s,"For DL training, What’s your model size and training dataset size? If you don’t know, or are just starting out then get the 3080. You can even train on the CPU when just starting out. 

One 3090 is going to be better than 2 3080 for gaming, but 2 3080s is better for deep learning as long as your model comfortably fits in the 10GB of memory. 

Having looked into this before, using cloud is actually very expensive if you are doing allot of training. IIRC, last time I checked, 4 months of training time on Ronin can pay for one equivalent GPU server. 2 months can pay for the 3090, assuming you need a PC anyway.",1.0
g6y7wuz,in4f8s,hy take a look at [vast.ai](https://vast.ai) for cheap rentals. its limited to dockers but it works,1.0
g6y6vqx,in4f8s,Wait for the RTX3080 20GB,1.0
g70izdu,in4f8s,"Keep a lookout for AI benchmarks here

[https://lambdalabs.com/blog/tag/benchmarks/](https://lambdalabs.com/blog/tag/benchmarks/)",1.0
g47hero,in4f8s,Neither. Go cloud only for DL unless its an excuse for a gaming rig.,0.0
g482sw4,in4f8s,"Would you mind sharing your reasoning? I'm in a similar situation as this poster and am mulling my options, and am curious how either of these would compare with the \~$1/hr tier from AWS. Granted, you could get 700hrs of train time for the same price as a 3080 but it seems like it might actually not be that hard to get there?",2.0
g485i0c,in4f8s,"Anything you are going to do for personal projects, the AWS free tier or Google Colab GPU/TPU is probably more than sufficient starting out. The way GPU's are evolving (2080 ---&gt; 3090) its just not worth it to try and keep up and when you go to work somewhere you will want to be proficient in the workflow of Google/AWS etc anyways. Large datasets, big models and managing dependencies local is good to know but you are going to deploy to some sort of web service even for your resume/interview. Go pro.",3.0
g48ejmh,in4f8s,"Hey, thanks for the cogent and reasonable reply/advice! The argument that a pro will need to know cloud deployment anyway holds a lot of water.

I  just started playing with Colab yesterday, and it's shockingly nice, actually. At the end of the day, I'm not personally going to go pro on deep learning as a career (unless one of these ideas rattling around my dome actually turns out to be a good one!). So, I'll likely plonk down for a GPU (my old 760 is hopelessly out of date, and I do a bit of gaming), but for someone looking to make a career out of data science, I bet you could skate on Colab basically indefinitely! I hit the RAM limit once, but if you're smart about it I think you can stay under.",3.0
g4bk530,in4f8s,"Time is more valuable than money. While one waits on his single GPU for 20hrs training, there is someone using multi-GPU in the cloud and getting 10x the work done as well. the 20hrs  week turns into 10 mins. No brainer. Unless you like to wait.",2.0
g4np4tv,in4f8s,"Of course you don't even consider the trial and error part of optimizing a model. I have never made it to one-time bulls eye. I spent all google free credits in one month for a binary segmentation problem and I didn't even finish optimizing the model. If there is no company backing to this kind of investments, building a 5k-7k workstation is more profitable in the long run.",4.0
g4t5nvp,in4f8s,"Some companies are investing into 4/8 GPU per 4u custom build servers. We are killing the value as we can build much cheaper, much faster machines than whatever you can rent out at AWS/Azure.  Most of servers is paid off after 2-3 months vs Azure/AWS (of course there is a bunch of limits like I/O, transfer, number of connections that limits us from using that kind a ""cloud"" service, not mentioning much more downtime per year (including degradation of their service) vs self-hosted machines).

Of course you need a person or two for an administration, but it is peanuts in comparison to cost of AWS/Azure for a growing tech company (we pay less to purchase, build and setup  for our beefy database/cache servers than a single month of an AWS/Azure db machine (that is much slower anyway, and we are talking about £12k/month mark per machine)).

Thanks to that, we are able to undercut any competition with our offering and virtually TONS of money saved by deploying regional self-hosted DC  is spent on new devs to grow even faster...",3.0
g5qgwn1,in4f8s,I'd love to know more about this. Any links?,1.0
g48htrf,in4f8s,"Last I checked AWS free tier gives no long-term GPU access. Colab != GCP, training on colab gives you exactly zero experience with the GCP workflow. The jump in GPU performance doesn't invalidate older cards, nor is there any pattern suggesting that GPU performance will shoot up like this again (remember, the 20 series provided little improvement over the 10 series which is half of why 30 series can be as big a jump as it is reported to be).

If you're doing anything more than fairly casual hobby it is easy to use up more cloud credits than the cost of these GPUs. The card is like what, $700? So lets say 1000hrs of training to offset it. That's like 20hrs a week of training for a year. The GPU will last more than a year and if you're training models that are of reasonable size and complexity it is likely that you're going to exceed 20hrs a week (that's just over one training run for my work, and I probably do that 7+ times a week personally).

I have never understood why everyone thinks the economics of cloud work for individuals working on moderate scale. The entire premise of profitable gpu clouds are that the hardware cost is quickly offset by the price of cloud credits. Small stuff can get away with the free stuff they put out for goodwill sure, and big projects/companies can get commercial discounts, but the intermediates paying full price are getting the short-end of the bargain",3.0
g71iufr,in4f8s,Another option would be to buy your own system and host it on \[[vast.ai](https://vast.ai)\]([https://vast.ai](https://vast.ai)) for others to rent when you don't use it.  Or rather than not paying AWS that crazy amount of money just rent an 8 GTX 1080ti system for $0.9/h.,2.0
g6y80lx,in4f8s,noooo!!! AWS is burning money. use [vast.ai](https://vast.ai) man. a lot cheaper and you get docker container that runs directly on the hardware.,1.0
g4vy389,in4f8s,"While I agree that it's more cost efficient, I personnally like having the luxury of my own GPU to train models on. Having a discussion on this is useful for those who don't mind spending more than is optimal for the enjoyment of it (similar to spending way too much on a hobby)",2.0
g4de1ro,in4f8s,"Just in case somebody actually does that, please, take notice of different GPUs and their pricing (t4 vs v100) and take notice of spot/preemptible instances.",1.0
g4418jk,imzl8f,"The paper: [https://arxiv.org/pdf/2003.12039.pdf](https://arxiv.org/pdf/2003.12039.pdf)

GitHub with code: [https://github.com/princeton-vl/RAFT](https://github.com/princeton-vl/RAFT)",2.0
g44y2gt,imzl8f,"So if you're moving and things you're looking at are moving, how does optical flow work.",1.0
g45vf84,imzl8f,"Optical flow is the problem of predicting how pixels move between two frames. The basic version of the problem doesn't tell you (and doesn't try to tell you) *why* the pixels are moving i.e. is it apparent motion due to camera movement or actual movement in the world. That's why it's called *optical* flow and is defined as *apparent* motion.

Many algorithms estimate optical flow as a starting point and then run a segmentation algorithm to separate foreground (motion in the world) from background (apparent motion due to camera movement). 

The thumbnail image in the linked video shows a pretty good example: the yellow background implies camera motion. But I only know that due to further interpretation of the optical flow and the original color image on the left.",1.0
g43enzi,imtulb,Sounds like embedded or internet of things.,1.0
g43fjwl,imtulb,"There is not really a standard one and everybody uses whatever sounds good for them. Embedded computer vision is something I heard among the more EE, ECE focused crowd. If they are really edgy they call it Edge AI.",1.0
g42sz2p,imtulb,"I don't know if there's an official name but it's basically embedded systems + machine learning, so I'd call it embedded machine learning.",1.0
g432ufg,imtulb,"Edge AI.
Or ""Edge Computing"" for the general term",1.0
g42u4rn,imtulb,The field is called soldering accelerator chips to the PCB.,0.0
g4bnvqk,imqa78,"I think OpenAI's braindead strategy of stacking more and more transformers thinking it will fix stuff when the whole architecture is gimped is too rich for researchers lol  


Sad that we resorted to CV methods in NLP",1.0
g415bfa,imib62,Just go to aws,1.0
g454orq,imib62,"What? Just start a deep learning VM with gpu, you can literally do it in less than 5 minutes.",1.0
g3zf2ja,img84u,"Want to grease the wheels of your TensorFlow knowledge?

Welcome to this tutorial series for beginners on Deep Learning with TensorFlow. In this tutorial, you will be able to take part in a mini-project that will help you to master the nitty-gritty of TensorFlow.

[**Stay Skilled - Stay Ahead**](https://www.youtube.com/channel/UCtOOo75kcRq_IFNVpHOUeLA)",1.0
g3zr4ms,imd41p,Code base?,2.0
g41w66q,imd41p,https://github.com/Rudrabha/Wav2Lip,4.0
g3xi208,im5l5j,"my totally opinionated opinion on why PyTorch: because it is simple, small, very clean, has a great architecture, is well documented, easy to work with / easy to develop and debug, is very flexible, is very stable, has a large ecosystem of well maintained libraries/models/etc., is not breaking (almost) anything in their updates, has a friendly and knowledgeable community, is not very opinionated, gets a lot of things ""right"" and is easy to distribute and parallelize in various ways.",3.0
g3yj9nv,im5l5j,"I haven’t tried pytorch but heard lot of good things about it. Using Keras already feel easy for me, i wonder how easier PyTorch be. Excited!",1.0
g3xv70e,im4xc6,"If I understand correctly, you want to match a virtual node to one of the physical which best matches compute resource and bandwidth request right?",1.0
g3y9th9,im4xc6,Yup,1.0
g3yjjch,im4xc6,"You can keep 2 inputs, 1 your virtual node matrix(containing requested data) and another input as your physical network data of dimension [adj_x, adj_y, node_matrix_dimension] and the softmax output is appropriate. I don't have a lot of knowledge about networks, so I am not sure",1.0
g404pxy,im4xc6,"But my main problem is not the physical network input, it's the  the virtual network request input. 

In virtual network request input , I wanna mention the virtual network request which is a graph and also point out the virtual node that I wanna assign( virtual node of  virtual network request )",2.0
g3w5j2r,ilzpk7,"RTX 3080 does not come with NVLink, only RTX 3090 have that. So you cannot link RTX 3080s if that is what you mean.",6.0
g3x7bqa,ilzpk7,"&gt;NVLink

Does this thing is any better then default parallelization?",2.0
g3w6dch,ilzpk7,"this article seems to compare usage of multipleGPU with and without NVLink ([https://www.pugetsystems.com/labs/hpc/2-x-RTX2070-Super-with-NVLINK-TensorFlow-Performance-Comparison-1551/](https://www.pugetsystems.com/labs/hpc/2-x-RTX2070-Super-with-NVLINK-TensorFlow-Performance-Comparison-1551/)) So i guess a performace boost works. (of couse a little below the expected performance)

or am I wrong? (I'd use tensorflow.Keras)",1.0
g3w6erb,ilzpk7,"You're not wrong, Walter, you're just an asshole.",5.0
g3w76k4,ilzpk7,"It literally says in the article, those cards have nvlink and he used nvlink bridge.",1.0
g3w87a4,ilzpk7,"It does, but I mean the setups used for comparison (see picture:[https://www.pugetsystems.com/pic\_disp.php?id=56590&amp;width=800](https://www.pugetsystems.com/pic_disp.php?id=56590&amp;width=800))

the ones, where it says 2x RTX {GPU} without the suffix ""+NVLink"", are they also using an NVLink?

If not then it should be possible, or am i missing something out?",2.0
g3wce6r,ilzpk7,"For machine learning, your cards do not need nvlink/sli.",2.0
g3wvqxc,ilzpk7,"Honestly based on your description, I think a single 3080 should be more than enough for your needs. (Your dataset is tiny)",2.0
g3ww0j1,ilzpk7,"Other than that, 3090 if you need the extra 4gb of vram (which I doubt) else 2x 3080 if you want to train multiple models at the same time. Will probably be a bit smoother than on a single gpu, but also possible",2.0
g3x2z0h,ilzpk7,"EDIT: forgot to mention: my script is going to train 6-20 models which are interdependent to one another (datawise and predictionwise), so my guess is, that it would take around 30-100 days without pause, to run my full script. (the interdependence, makes it far less easy but not impossible to parallelize,but the amount of RAM used during preprocessing at the same time will probably be tooo big)",1.0
g3vjgyn,ilxpy1,"For AI experts, I was expected more analytical justification... and less feelings. 

This survey seems skewed to say the least. 

What about the large sums of money China is using to attract AI researchers?",3.0
g3vw401,ilxpy1,"I agree, and you beat me to the punch.  This quote kind of summarizes the article:

&gt;As a Canadian, I hope that the next AI hub will be in Montreal.

Most of the respondent's ""predictions"" are based on factors that could literally be used to ""predict"" where the next hub for any field could be.  Things like ""democracy, tolerance/multiculturalism, and freedom of speech, several world-class universities, affordable housing, English language"" don't really seem particularly specific to AI.

I'm not saying their necessarily wrong, but a more accurate title for this article would be ""We asked some AI experts what cities they wouldn't mind moving to"".

Edit:  Just to save someone a little time, the answer seems to be somewhere in Canada, like Toronto or Montreal.",2.0
g8aq409,ilxpy1,Montreal will be the next ai hub in my view based on recent decades openings of tons of research center from major companies. Also the ai infrastructure is there to take it to next level. Great minds like yoshua keep training his decipiles not only on his lab but also helping ai startups to flourish. Next ai Montreal program is just a tip of the iceberg. Also there is some kind of movement started back in 2017 https://youtu.be/Zfpsq7gIcvI for pushing the limit. So it will surpasses China in many ways in upcoming years in the field of ai.,2.0
g3vczrc,ilwsv2,"With sufficient ventilation it's not really a problem. Just make sure heat can escape your basement with something like an exhaust fan. Your hardware will throttle themselves when they overheat. Crashes from overheating only happen when hardware fails, or when the ambient temperature gets too high.

Backup in such a long process, however, is always necessary. Accidents happen.",3.0
g3x54f4,ilwsv2,"I think the point that needs to be addressed first is the question why it is impossible to reboot.

Afaik there is always a way. And there should always be a way.",1.0
g3xdfgf,ilwsv2,"If your PC is built correctly  your GPU and CPU should be able to run at 100% indefinitely without needing interruptions to ""cool"". If you are having problems with overheating, something is wrong with your system build, not your code.  


When you build the computer make sure you know the basics around system cooling -- where to put case fans and which directions air should flow. There are plenty of guides on internet and Youtube and in the pc gaming subreddits. Also make sure the room itself doesn't become a factor.  


Also closed loop watercooling is super safe and effective, what are you concerned about there?",2.0
g3xns90,ilwsv2,"thx for this answer. Im a little concerned because my workstation should run for 30+ days without rebooting. Its not build yet, but will stand in a relatively cool basement.

Watercooling concerns me a littlebit because of something running out. also transportation can be far more difficult. plus has to be inspected more often than an aircooler (i guess). 

can you recommend a guide on system cooling?",1.0
g4bnlj3,ilwsv2,"&amp;#x200B;

make sure you have good ventilation in your case. gamersnexus does tests for airflow in pc cases. there is absolutely no point in ""pausing"" computation, as soon as you hit the cpu and gpu with a high load temps will just jump up. if you are not comfortable with the temps you're looking at you can always underclock, but that shouldn't be necessary. 75°C to 80°C on nvidia gpus is to expect. if heat is dangerous to your system it will emergency shut down anyways. 

[https://www.gamersnexus.net/guides/3604-best-gaming-pc-cases-for-airflow-in-2020-right-now](https://www.gamersnexus.net/guides/3604-best-gaming-pc-cases-for-airflow-in-2020-right-now)",1.0
g4crfs6,ilwsv2,what are temps? (english isnt my motherlanguage),1.0
g4crk8g,ilwsv2,Temperatures,1.0
g3vb0ih,ilwsv2,"Under-clocking and under-volting can help. I train small cpu intensive RL models (5-6 hr training time) on my laptop. With stock clocks, the core temps often crossed \~95 C and it caused throttling. Now I artificially limit the max clocks to 2.8GHz (Theoretical Max-3.5GHz). The core temps now remain in low 80s and the training time is also improved by 10-20% because of no throttling. My laptop GPU does not support under-clocking / under-volting, so I don't have any experience in the GPU dept.",0.0
g3uql74,iltyq5,"3090s are triple slot. I haven't seen a motherboard with 4 slots, triple spaced.

No doubt someone will eventually make one for your use case, but given we only just know that the 3090 is triple width it might take a while.

Either that or one of the aib makers narrows it..",6.0
g3uuoth,iltyq5,Water cooling four of them could work if they have dual slot io shields.,5.0
g3v51x7,iltyq5,Good idea!,2.0
g3ut1ye,iltyq5,Thx for the info. Do you have an idea on how long does it usually take for manufacturers to release compatible hardware?,2.0
g3uyikm,iltyq5,[deleted],3.0
g3wtuqf,iltyq5,"Are you using risers of some sort, or one long board?",2.0
g3wu57g,iltyq5,[deleted],5.0
g3wuvvy,iltyq5,"I have an old crypto frame as well, I’ve held on to it hoping to make a ML rig eventually. My concern is the risers I have are either x1 or x4. 

Do you use similar risers without bottlenecks or do you have x16 ribbons?",3.0
g3wzwlw,iltyq5,[deleted],3.0
g3wzzsl,iltyq5,Gotcha. Thanks for the info 👍🏻,3.0
g43gx8n,iltyq5,"Wow! I never knew you could have more than 4x GPUs on a single device! What's the motherboard you're using?

I'm wondering whether it has 6x PCIe slots or you're using some other way to make that possible. (Believe me, whatever you say is probably gonna sound like magic to me, I never knew riser cables exist until I read them in another comment xD)

What about the CPU?",1.0
g3x7nwa,iltyq5,"Hi, I'm also looking to build 4x 3090 rig for rendering. I got experience with 4x Titan RTX on two motherboards.  One is older Intel based : Asus Z10PE-D8 WS and second AMD based : Asus Zenith  Extreme.

For the case I would suggest Thermaltake W100 or even better WP100 which is two cases connected into one (W100 and P100). The price is really low for the options it gives you.

The main components I would use for today are :

\-Asus Zenith II Extreme Alpha as a motherboard

\-AMD Threadripper 3990X

\-256GB DDR4 (8x32)

\-4x RTX 3090

\-Nvme ADATA Gammix S50 2TB

\-some HDD in RAID for example 2x 18TB WD HC550

\-2x Corsair AX 1600i power supply

Some old photos Intel based rig:

[https://ibb.co/gd6hr5G](https://ibb.co/gd6hr5G)

[https://ibb.co/jwqWxQc](https://ibb.co/jwqWxQc)

I know how it looks but I had to make it work in extremely short notice and I took a pic that day :) You may also get few aluminium profiles and make a rack inside this case for your 2 cards connected to the raiser cables.

Raiser cables are a must for 3090. I doubt that any company will make 4x 3slot motherboard in size. It's not going to happen. I wouldn't suggest going watercooling route because of the additional maintanance involved. Been there, done that. Not worth it IMO. If you would get proper case with big fans from Noctua you wouldn't have any problems cooling the setup under load and it would be reasonably quiet. The watercooling is neccessary only if you are planning to overclock your rig alot. Hope it helps a bit to anyone.

Also the power supply which is in the main W100 case in my photo could be put below to the P100 right beside the first PSU for more room for 3090 cards and mentioned before aluminium rack.

&amp;#x200B;

Custom case made from aluminium profiles I found on Redshift forum:

[https://ibb.co/q9kGr3z](https://ibb.co/q9kGr3z)",3.0
g42nsqu,iltyq5,"what do you do for a living? 

256Gb ram seems like overkill but i dont know how much you guys use ram",2.0
g43gcvq,iltyq5,"For me, I honestly, was just gonna go with the convention that you should have 2x RAM as much as you do have vRAM. Maybe 192GB is enough. But is it efficient to have modules of different sizes? e.g. (4x 32GB + 4x 16GB) What is the worse that could happen in such a scenario?",1.0
g47jzyp,iltyq5,Highres VFX simulations :) Believe me I would gladly get 2TB memory if I could afford it.,1.0
