comment_id,post_id,comment,upvotes
g27nzot,id5o4m,"Think curve fitting.

If you have some 2D data points and you're trying to fit some curve in it, then big weights means that your curve can have very vertical portions and accommodate the noise in the data (since weights == slope).

If you penalize large weights, then you encourage your model to fit the data with more ""horizontal"" / flat curves, ie having less variations, simpler, and hopefully more general.",1.0
g28he8s,id5o4m,"To understand, think about the intent of the term 'variance'. In linear regression, say you would like to learn the weight vector. If I gave you dataset 1, you would learn weights 1, whereas if I gave you dataset 2, you would learn weights 2. If I ran a million trials, and gave you a different randomly sampled dataset for each trial, you would get weights 1, weights 2, ..., weights 1 million.

The average of all of these weight vectors is called say w\_avg. The average squared distance between any weight you learn from one dataset and w\_avg is a measure of variance. w\_avg will have the best performance among linear predictors, so we'd like to be close to w\_avg. If we allow the weights to be arbitrarily large (no regularization), then the variance can be arbitrarily high, as the squared distance is higher if the different weight vectors are large in size. If we regularize, then we make all of weights 1, weights 2, ..., weights 1 million \*smaller\*. This also means that w\_avg is now smaller as well, and may go down in predictive performance (this is called bias). However, because all of these vectors are smaller, they will have a smaller squared distance to the new w\_avg. Controlling how much smaller to make the vectors such that weights 1, ..., weights 1 million are close to w\_avg, but that w\_avg is not so biased that performance suffers, is called the bias-variance tradeoff.

In deep learning, of course, there are many more details. But this intuition from LR should do the trick.",1.0
g275kmz,id5o4m,"A student too myself, but here is my understanding of it. During the training of the model, large weights (w) will produce large weight gradients (w') and thus large weight updates ( eta \* w', where eta = learning rate). Thus, with each data-point the model trains on, it produces large weight updates in the direction of fitting this data-point. In other words, it tries to fit each data-point closely and loses its generalizing capability (ability to make small updates to weights and moving gradually towards lower loss). This of course, is the definition of overfitting. Thus, larger weights are a telltale sign of an overfitted model.

Large updates (whether a large weight or a large learning rate) also means that the model has a chance to overshoot the loss value minimum (or atleast produce large oscillations in the loss value), which is wasted compute. Again we prefer small updates so that we definitively move in the direction of the loss-minimum with each update to the weights (optimal use of compute). Hence we use regularization to keep the values of the weights small.

As mentioned above, I'm a student myself so please feel free to correct any errors! :)",1.0
g25zlrg,id0mjx,Check out the Neural Net Study Group discord server,2.0
g260sg6,id0mjx,"Oh okay, I’ve never heard of that. I’ll check that out, thanks!",1.0
g259fz8,icwo6v,Concatenate them. You could also use a feature importance approach to remove less informative elements of the embeddings.,2.0
g259qud,icwo6v,"Can you explain a bit, How I can do that and at which point should I do? But If I am not wrong then feature importance part is handled by multi-head attention right?",1.0
g25rkh4,icwo6v,How are you encoding the book?,2.0
g25sd3x,icwo6v,using vocabulary and then sending it to Autoencoder,1.0
g2794vi,icwo6v,"Are you using a bag of words of every token in the book?

How do you know you have an informative embedding of the book?

Encoding a book into a 200 dimensional feature space seems hard.",1.0
g26lfxi,icwo6v,"If your goal is to classify each book, why are you combining them? It seems like you would want a singular model to output embeddings for each book, and then feed those embeddings into a second model for classification.",1.0
g25qrep,icvjpa,"The FastAI library is built on top of PyTorch to make ML “easier” and faster to get good (sometimes very good) results in just a few lines of code. Digging in deeper into the functionality for more insight into how it does that is up to you. The library is on GH and is well documented. 

FYI, the FastAI v2 Deep Learning course will be released on Friday. Might be worth waiting to start with v2.",1.0
g26h6zt,icvjpa,"but I've always heard that some most companies prefer to form all these algorithms from scratch rather than using these libraries. 
so that's why I'm asking if it's worth learning the fast ai library.",1.0
g26kzx9,icvjpa,"Google pretty much owns Tensorflow while Facebook started and extensively uses PyTorch. Both are open source and considered lower level libraries that have similar performance. Keras is a higher level API that runs on Tensorflow, like FastAI runs on PyTorch.

Edit: to answer your question... it’s almost like asking should you get a PC (TF) or a Mac (PyTorch). You will be up and running faster with FastAI and more easily transition into PyTorch details later. The Keras to TF transition is not as simple if you need to get past Keras limitations.",1.0
g26ldjw,icvjpa,"so just to clear it up, FastAI is also used in the industry and I can continue with the course.",1.0
g26mg1a,icvjpa,"I do not believe “industry” would use FastAI for serious DL in production. They would go straight to PyTorch for better lower level control. 

FastAI is great for learning ML/DL quickly, pulling in your own data, and getting good results.",1.0
g26nxr8,icvjpa,"I'm sorry for asking so many questions. 
But, I'm confused now. 
As a beginner, should I continue with learning the fast ai library , or start with Keras and Tensorflow first?",1.0
g26o80b,icvjpa,"Again, that is like asking if you should buy a PC or a Mac.... it depends on what you want to do with it in the end. There was another post a while back with some good discussion that may help you... I'll see if I can find it...",1.0
g26oip5,icvjpa,"[Here](https://www.reddit.com/r/MachineLearning/comments/bd35be/d_where_does_fastai_as_a_library_stand_against/) is that other post I mentioned with the discussion... it was a year ago, so judge accordingly as things change fast in ML and even these folks may have different opinions today...",1.0
g265tv1,icubem,xinghaozong@yahoo.com,2.0
g26qs37,icubem,Would have loved it.  Just finishing the final week of the specialization in the next few days.,2.0
g27n6it,icubem,"Congrats! Yeah, I created this because I’ve taken too many online courses alone. Learning with others &gt;&gt;&gt;",1.0
g27d1sv,icubem,are you starting the course today or at the next date?,1.0
g27n3a9,icubem,Both! We’ve had enough signups to get started but some people can’t start immediately and have opted in for next round.,1.0
g24996a,icoag8,The color and shape bias in this training/test set seems pretty stark.,1.0
g24xzzf,icoag8,[deleted],0.0
g25jhhl,icju7d,I like to use !wget to pull in the dateset from its url,0.0
g26063j,icjjor,"Cool idea, my opinion is focus money on expensive hardware that groups of people can afford to purchase together like really nice gpus but also fpgas, robotics hardware, and- when it’s available- neuromorphic computing cloud time.",1.0
g22x98u,ichz5i,[deleted],33.0
g231gt4,ichz5i,"Yep, could easily hard code all those code snippets..",15.0
g23ve38,ichz5i,GPT-3 is a gigantic trained NN.,2.0
g23j87r,ichz5i,The Gpt 3 paper?,1.0
g248m9c,ichz5i,https://arxiv.org/abs/2005.14165,4.0
g24ff78,ichz5i,AI should first try to learn the indentation syntax fundamentals before anything else.,3.0
g25egbu,ichz5i,Oh then we can have model v model tabs-spaces flame wars yes please more of this. This is what the world needs rn,1.0
g25r536,ichz5i,At least the model Vi vs Emacs war will be easier: set two identical RL agents simple programming tasks and watch the Emacs Bot get bogged down writing LISP macros...,3.0
g24d0re,ichz5i,"That's fucking amazing, so are you going to become an overnight millionaire and market this thing?  Or are you like the GP3 guy from Openmind that comes here to show us something incredible... seemingly just to individually tell each person asking for source in the comments that you can't share the code?  =p",4.0
g24m0ao,ichz5i,"Um, link?",1.0
g254hxy,ichz5i,"Wait... which link, the one for becoming an [overnight millionaire](http://www.google.com/search?q=how+to+startup+software+company+marketing+revolutionairy+voice+to+code+products), or one for the [reddit post I referred to](https://www.reddit.com/r/deeplearning/comments/iblhzl/personal_gpt3_project_guess_the_movie_you_cant/)?

\*Edit\*  oh shit am I behind... just found out about tabnine and kite's autocomplete features.",1.0
g22s41r,ichpqw,"What you're looking at is actually a picture of your training set. The circles are one class, and the xs are another class. The blue line is your decision boundary. 

In the picture on the left, the decision boundary is essentially a straight line. It won't change very much if you give it different training data, but it won't be very accurate either. In the picture on the the right, your decision boundary is snaking all around your data, capturing the noise in your training set along with the underlying concept. If you had given your model different training data, the decision boundary would look drastically different, meaning that's high variance.",3.0
g239l2n,ichpqw,"And, just to add, ""high bias"" on the left means that the model assumes that data is **linearly separable** which is a very strong assumption -- so the model is biased already, without even looking on your actual data.",1.0
g24e54c,ichpqw,"Thanks, that makes sense. Could you clear up another thing for me? Wouldn't L2 regularization, by affecting the weights, both reduce variance and increase bias just as much? So why would this be an improvement upon our network? How do we know that making the noise less prominent won't also make our function less true to the underlying concept?",1.0
g254fim,ichpqw,"Sure. 

Essentially, what regularization does is force your decision boundary to be less ""curvy,"" as smaller weights mean a simpler model. You control how curvy you want your model to be by adjusting ƛ.

In general, increasing ƛ will decrease your variance and decrease your bias, **but not necessarily by the same amount**.  If you're overfitting (ƛ is too small), then increasing ƛ will reduce the variance a lot more than it will increase the bias. Conversely, if you're underfitting (ƛ too large), then making decreasing ƛ will reduce the bias more than it will increase the variance. 

If perturbing ƛ reduces variance and increases bias by the same amount, then rejoice for you've found the coveted sweet spot where you're neither underfitting nor overfitting.",1.0
g21vpqe,icdmm9,HI EVERYONE,0.0
g20e17z,ic4ucs,Speech models still got a long way to go,32.0
g20y1a0,ic4ucs,Two more papers down the line !,18.0
g20lcr5,ic4ucs,"Yeah, Obama is the hardest, by the way, female voices are better",5.0
g21e84p,ic4ucs,I'm not up to date on text-to-speech but isn't that just because we have more female data samples ?,2.0
g21niul,ic4ucs,"no, it's just because the voice frequency is higher and there is less data in one wav file",3.0
g22crcm,ic4ucs,"Did it say ""supprarp""?",1.0
g20lp8w,ic4ucs,"RIP Facts, 2020",13.0
g20zfrh,ic4ucs,F(acts),6.0
g21rwh4,ic4ucs,"What’s the name, any GitHub link?",6.0
g21yqj9,ic4ucs,+,2.0
g22fea5,ic4ucs,"Name is in the video 
https://parodist.ai/",1.0
g2324tm,ic4ucs,The parodist app (parodist.ai),1.0
g2325fh,ic4ucs,"**I found links in your comment that were not hyperlinked:**

* [parodist.ai](https://parodist.ai)

*I did the honors for you.*

***

^[delete](https://www.reddit.com/message/compose?to=%2Fu%2FLinkifyBot&amp;subject=delete%20g2324tm&amp;message=Click%20the%20send%20button%20to%20delete%20the%20false%20positive.) ^| ^[information](https://np.reddit.com/u/LinkifyBot/comments/gkkf7p) ^| ^&lt;3",1.0
g22p985,ic4ucs,fake voice or video?,2.0
g232313,ic4ucs,Voice,1.0
g22l6u8,ic4ucs,"&gt;And that's why I'm **surprad** to **enderse** Elon Musk as president

Well said, Mr. President. Well said.",1.0
g22lfzo,ic4ucs,"But for real, this shit's starting to get pretty concerning. We're gonna be in some real trouble in 2-3 more years...",4.0
g22wuw5,ic4ucs,"Reminds me of the time when a German voice imitator had a comedic radio show where he imitated our Chancellor at the time (Gerhard Schröder), called it the Gerd show and some people started complaining why our Chancellor had time to do such a show, including singing songs.   
Meaning: This stuff is concerning for quite a while now, since some people are easily fooled even by bad imitation (or even without any evidence - just tell them someone they dislike said something bad and they'll dig it). Which is btw why it would be important to teach kids about fact checking and spotting misinformation in school. Should be a basic class early on.",2.0
g232s7f,ic4ucs,"Yeah, that is why we do not open full access to the synthesis, only through templates",1.0
g22o4g2,ic4ucs,That’s why I’m so prod to enderse Elon Musk,1.0
g20xn44,ic16at,"Hi, I'm no expert either, but I can tell you that 30 samples is very limited. So the first thing you are going to want to do is find ways to increase the number of samples i think. Ask around i guess. You could also experiment with artificially generating more samples based on your 30 images by messing with colors, rotation, gamma etc. No idea if it will work for you, but I overheard my teacher suggest something like this to another student a few months back.

Other than that, it sounds like you already have chosen a framework (pytorch), which means you already have something that fails to do what you want. If you want help, people need to know what you have and how its not living up to your hopes and dreams. Lastly, once you have a clear and answerable question, try asking on stackoverflow aswel.",2.0
g21kamx,ic16at,"Ehh, I wouldn't worry much about trying to do transformations on the image. I'd imagine 30 is enough for a pretrained network. 

My advice is to check out the first lesson, maybe first two lessons, of [fast.ai](http://fast.ai) Practical Deep Learning for Coders.",1.0
g23gac2,ic16at,"Since you want to do K Means clustering, I'm guessing you want to make use of the pre-trained models to extract features from the images. You can then use these features to perform regular K Means.

&amp;#x200B;

So read about how to do feature extraction in PyTorch. You'll have to modify the pre-trained models to output features from an arbitrary intermediate layer. Once you have the features, you can use traditional ML libraries such as sklearn to perform K Means.",1.0
g1yz0y5,ibyn8l,"1. [https://pc-builds.com/calculator/Ryzen\_3\_1300X/GeForce\_RTX\_2060/0Nj1378B/16/100/](https://pc-builds.com/calculator/Ryzen_3_1300X/GeForce_RTX_2060/0Nj1378B/16/100/)  
Do you want two gpus because of speed or parallel training more models? 
2. You need to check number of lanes. One gpu can handle with no problem, but I don't know about two.
3. If you don't plan to train multiple models simultaneously than one better gpu is better than two ""average"" gpus.
4. RTX is better than GTX because of tensor cores.",3.0
g21bphl,ibyn8l,"u/matej1408 

1. ye 
2. Ok
3. Ok,  I think for tensorflow from what I understand two gpus seems to scale well with it
4. OK

thanks for the advice",1.0
g1wofw7,iblhzl,"That's really cool! Do you have an online demo which I can try, or a precompiled binary that I can download and run locally?",7.0
g1wyn58,iblhzl,"I'm really sorry, but as of now, I can't put this demo into production. This is because its a beta version of the GPT-3 model so you'd need an API key to make it work. Thank you for the support though 🙏",2.0
g1xiahw,iblhzl,Can you let me know how to get access to GPT-3?,5.0
g1yj3w7,iblhzl,"Yes, I applied for the OpenAI API waitlist in their official website.",1.0
g1yqbhf,iblhzl,How long did you need to wait?,2.0
g1z0uzv,iblhzl,"Emm, I think I waited for a week back then.",2.0
g1z2j3r,iblhzl,It's been several for me without any response. :(,2.0
g1zfjp3,iblhzl,"Well, there is another way you can accelerate your beta access ( its by sending an email to OpenAI's CTO, you can find more details provided by him [here](https://www.reddit.com/r/OpenAI/comments/hmdrbt/how_likely_is_someone_to_get_into_the_api_beta/) )",2.0
g1xlrc2,iblhzl,For a production system what would you feed as training data? Synopsis of the movies? Synopsis + IMDb user reviews including spoilers? I guess users would usually query details not included in the synopsis...,3.0
g1yj6de,iblhzl,"Well, for the GPT-3 model, it has been trained on a large corpus, so I'm guessing, many comments about movies have been in the training data. It's a few shots learner so it doesn't need a dataset, it just needs a few examples to pick up the pattern you're reaching for.",1.0
g1xfh3p,iblhzl,"This is so cool!! Can it return multiple options?  Like if I searched ""movie with Charlize Theron"" or something not so specific.",2.0
g1xgu9b,iblhzl,"Sure, if its trained on that task, it can do so",3.0
g1xks20,iblhzl,Is there a GitHub link for this project ?,2.0
g1yj7th,iblhzl,"I'm sorry, but it's using a beta version of OpenAI's API so I can't open-source it",1.0
g1y4jbw,iblhzl,Awesome! Any link to this project? I also want to try it,2.0
g1yj9fh,iblhzl,"I would love to post the project but as I said, it's using a beta version of OpenAI's API so I can't post it. You'd need beta access to make it work.",1.0
g1z9gpv,iblhzl,I was looking for a movie today to share with family. Could you search it for me please?,2.0
g1zfexr,iblhzl,"Sure, dm me the description and I'll hook you up",1.0
g1zlkju,iblhzl,"At this point im convinced people named mehdi are genius, i already know 2 that are absolute genius now im puting you in that bin too.",2.0
g1zozpv,iblhzl,"Aww, that's so sweet of you. Thank you for the support ❤",1.0
g21n8w8,iblhzl,"Hey guys, are there any minimum hardware requirements for running the GPT-3?",2.0
g23wmmg,iblhzl,"Not really, cause as of right now its just an API that accesses the real GPT-3 model.

As for the requirements for the real model, when it gets released, I really don't have an idea",2.0
g23xr7c,iblhzl,Thanks for the info bro.,1.0
g236zvh,iblhzl,You could create a bot and let it run in r/TOMT for testing.,2.0
g23wn2g,iblhzl,Great idea,1.0
g1zpt19,iblhzl,Cool what dataset you'd used?,2.0
g1zrldc,iblhzl,"Thanks.

That's the magical part! Its that it doesn't even need to use a dataset!

This model uses few shots learning to train, so it just needs a few examples to pick on the pattern, amazing isn't it?",2.0
g26wm5c,iblhzl,"Yeah, sure it is. 

So you didn't use any official dataset. But how much data you'd used for the sake of this demonstration? I'm assuming these are your test queries.

But great work and application, thanks for sharing it.",1.0
g1w97s4,ibk6ei,"Take a look about siamese networks. They generate a z embedding that is used to compare objects. Maybe you could do something similar using the same encodee to produce two embeddings, using a net or some math to mix  the embeddings and then generating the middle net",4.0
g1wgmkr,ibk6ei,"I'll take a look, thanks!",1.0
g1wg4hf,ibk6ei,"Check this out  [https://arxiv.org/abs/1904.03189](https://arxiv.org/abs/1904.03189), they demonstrate an effective way to embed images in to the latent space of a StyleGAN and then you can interpolate between the two vectors fairly easily. They achieve some really impressive interpolation results provided the underlying generator can actually generate the images you care about.",3.0
g1wle3d,ibk6ei,"It sounds interesting, so I basically do a mix of the previous image and the next one",1.0
g1wltb2,ibk6ei,"Yeah, find latent representations of each and then you can find a middle representation. Main issue is it assumes a smooth latent space. That's a property StyleGAN and its successors worked on extensively, so it may not work as well on more basic GANs where the latent space is more entangled.",2.0
g1wn7eu,ibk6ei,"Okay, thank you very much, very interesting idea",1.0
g22dfa4,ibetgl,"I like it. I just did a similar self-project using Deep Q-Table, then Deep Q learning.  The table approach worked really well given the small game-space.... the Deep Q learning was a bit trickier with similar problems as the agents tended to play the same (or equivalent) games repeatedly - I had to introduce a high degree of randomness to force learning of alternative game states.",1.0
g2d3wv9,ibetgl,"I guess deep learning is an overkill for this simple game. Look into Kaggle's ConnectX competition, that's a better challenge. I've just implemented MCTS and its worked really well",2.0
g1v2jsm,ibengm,"AMD is not invested, and It is a loss for them to focus on GPU for AI. The market share of Nvidia is 100% and trying to get a bite of the AI GPU share market will take years of investment.   
Nvidia has invested in all fields of research in AI and whereas AMD only a team in California consisting of few people working on Rocm (That’s all I know).",5.0
g1v73fd,ibengm,so RocM is the amd's invest for ai?,1.0
g1vio4e,ibengm,I don't know if it is good to call a mockup an investment since it is open source.,4.0
g1x5fe8,ibengm,"&gt; cuz I'm only 16 yo with stupid question 

That's not an excuse for not trying to speak in sentences, man.",1.0
g1ziisy,ibengm,Sorry man.😓😓,1.0
g1wsnd9,ibej84,No. They're not random.,2.0
g1u2t9h,ibaij2,"I was reading this paper earlier but am not too familiar with reliability but maybe you can get something out of it, 

http://openaccess.thecvf.com/content_CVPR_2020/papers/Zhu_S3VAE_Self-Supervised_Sequential_VAE_for_Representation_Disentanglement_and_Data_Generation_CVPR_2020_paper.pdf",1.0
g1t4wns,ib7o2d,Doesn't the specialization has homework where you do the implementations?,5.0
g1t5yhp,ib7o2d,Yup it has. Which I completed.,-1.0
g1ulkrv,ib7o2d,There you go then,1.0
g1t8ehp,ib7o2d,Depends on the language you want to work with. MATLAB has a great deep learning toolbox to save you implementing the algorithms. Python also has similar libraries. Id recommend keras. Other than that it's up to you to choose an application. Computer vision is pretty good as a starting point,1.0
g1tbqe8,ib7o2d,"You need a business case.

Go try to detect game in a cornfield from images.",1.0
g1tf70g,ib7o2d,"I think after all there's a gap between this course and a reality. I would advice to keep in mind, that real business cases usually a long or midterm tasks that is hard to complete because of many reasons, so it's more like a process.

I would suggest you to read a book from MXnet authors ""dive into deep learning"" just to backup your knowledge.
And while you do this I would suggest either find on GitHub any working repo that is interesting for you, and try to retrain it with your data(but this mostly doable with unsupervised nets) OR try to find employer who will send you a task and data to check your knowledge, which is actually worked for me",1.0
g1u4j6h,ib7o2d,Read the new Fast.ai book. I also completed the deep learning specialization and it was amazing but highly theoretical. Fast.ai is primarily focused on becoming a DL practitioner and you will work through many projects in different domains.,1.0
g1t8krz,ib7o2d,"After doing the same course, I did the exercises given in the book - Deep learning with python by Francois chollet ( the creator of keras)",1.0
g1t1t08,ib791z,"Just thinking out loud here:
1. What kind of initialization are you using? Maybe changing that to something farther than zero can help?
2. More of a long shot: add a penalty term to your loss that is the proportion of zeros in your output times some weight?",1.0
g1t6juq,ib791z,"Alright, I figured it out. Most CNNs that output back into image space are using L1 or absolute value loss since the data is not sparse. But classification problems typically have very sparse outputs, like one hot encoded vectors. In that case, people use cross-entropy loss, which is a type of log loss. 

In my case, if I also use a log loss (in fact, my images tend to be B&amp;W anyway), this problem goes away.",1.0
g7b2swi,ib791z,I am having a similar issue using MATLAB. My input and target images are also sparse and I am running into the same problem. I have done some research into cross-entropy and have not been able to implement a working solution. How did you implement your cross-entropy loss function and backpropagation? Thanks!,1.0
g1t0c7o,ib70mq,I have a model that very accurately predicts tomorrow's share price for the NYSE. I can share it with you for a price. Please send me $10 billion and I will give you a diagram with trained weights.,59.0
g1t3mko,ib70mq,"Lol my bad, probably shouldn't have asked for free implementations :p",7.0
g1uv0rb,ib70mq,[deleted],3.0
g1vd0zj,ib70mq,Exactly. They would have made like Ed Thorp when he figured out how he could take the house down with blackjack.,1.0
g1twps6,ib70mq,BS! Trained weights cannot be stored in a diagram,6.0
g1uknf7,ib70mq,He said diagram with trained weights. He never meant a diagram of trained weights.,4.0
