comment_id,post_id,comment,upvotes
g8ovrde,jacdk8,Have you considered using some cloud GPUs instead of running locally? It will likely be a lot cheaper,3.0
g8ou424,jabsdc,"Umm as far as I know, you will be creating a vocabulary / using embeddings for your words. Won’t that be enough?

What is your use case?",1.0
g8ozv5n,jabsdc,"Thanks for replying. With the sentences, I have allied metadata which essentially is the context in which sentence was said... This is ordinal data and I want to include this context. So this metadata has to be one-hot-encoded and I want extract the features or ""include"" this context in the already encoded sentence",1.0
g8op1jk,jaaza1,Difficulties... like what? There’s a thousand things under “coding the model” you could be talking about here. There’s literally nothing we can help you with based on what you’ve told us so far.,3.0
g8otayr,jaaza1,Like deciding on what to do next and how to do next.,-1.0
g8ou2uu,jaaza1,"Do you not see a problem here with how you're asking this question?

There's literally thousands of potential decisions you could make. We cannot read your mind. We have no idea what types of decisions you're struggling with.

Regardless, your best bet here is to take - and really internalize - several in-depth deep learning courses.",4.0
g8opr4o,ja5sct,"Contrary to popular opinions, the DL book by Goodfellow is Not a good text for anything. You'd be better served taking a Mooc. 

On the theory side of things, I understand your frustration (I feel the same) but there is no other way other than to study those topics and practice them. If you want to be more rigorous in your approach, then look up the bachelors Applied math and stats program for Caltech and study the courses which you haven't before.",5.0
g8p4s0r,ja5sct,Yes it is a horrible book for a beginner. The book glosses over so much math it's impossible to learn from the book if you are a beginner.,1.0
g8nv7cx,ja5sct,"I'd start with ***Deep Learning*** by Ian Goodfellow, Yoshua Bengio and Aaron Courville.",10.0
g8ovw2u,ja5sct,Online version free btw,2.0
g8nztvj,ja5sct,it more about non convex optimization,4.0
g8oqh45,ja5sct,"https://www.cs.huji.ac.il/~shais/UnderstandingMachineLearning/index.html

This is a good introductory book on what you are looking for.
It would be a much easier read if you know probability well and understand at least some real analysis",2.0
g8pkqoo,ja5sct,This is another good one in a similar vein https://cs.nyu.edu/~mohri/mlbook/,1.0
g8o3q67,ja5sct,"Are you only interested in theory or do you have a practical goal in mind.

If the latter, as an engineer myself I started by using Deep Learning on Kaggle (https://www.kaggle.com/learn), then implementing it and reading papers at the same time.",4.0
g8ppblb,ja5sct,Following,1.0
g8nzczd,ja5sct,Commenting to follow this thread.,1.0
g8o7cq2,ja5sct,Me too.,1.0
g8oj66f,ja5sct,Follow this thread,0.0
g8okilp,ja5sct,Commenting to follow thread,0.0
g8pg2mp,ja5sct,Following,0.0
g8nbu94,ja1e1e,"This is from David Silver’s reinforcement learning course, no? If so I’ll try to find some notes that I should have saved that might help.",5.0
g8nhu47,ja1e1e,"He was able to explain how to verify a state value using bellman's equation but nothing on how to calculate each individual state... I'm genuinely confused. If you could, I would be absolutely grateful if you could share the notes with me.",4.0
g8nqcwq,ja1e1e,"For particularly small problems (like the graph shown above), the standard approach is through value iteration.

1. Initialize the states with the immediate rewards of that state. I believe in this example, everything starts off at 0 (but other problems there are desirable states to be in).

2. Update each state values based on the next best state (i.e., the action that has the best expected reward based on the state you land, make sure to include rewards/costs of taking that action). This step could also be according to some policy in which case you'll be updating expected transition rewards according to that policy (which could be deterministic simple sum of action reward + implicit resulting state rewards, or probabilistic where you use expected value of policy). Generally, each action has an associated probability of transitioning to some other set of states (non-deterministic transitions).

3. Repeat until convergence of values (updates no longer change state values).

Hope this is helpful. If you have a discount factor, it's important to include in the calculations of current state valuation = reward(state) + y(value of next state under our policy)",6.0
g8nqo22,ja1e1e,Exactly. Since you have the MDP fully defined you can simply use dynamic programming to calculate all the values.,2.0
g8nysln,ja1e1e,"This was well explained, thank you for taking the time to write this. I'm still a little fuzzy on the calculations though. So if I start at the node containing -1.3 (pretending that all nodes are empty). To calculate in order to get -1.3, would It be -2(reward state) + 1(gamma)? Where does the policy go into the calculation? I apologise I'm a little slow lol",1.0
g8oa88s,ja1e1e,This isn't Deep Learning,1.0
g8oarze,ja1e1e,Lol then what is it then?,0.0
g8okiic,ja1e1e,"Reinforcement Learning is a machine learning paradigm. You don’t need to use DL to solve these problems, in fact, in this case you have to use dynamic programming",1.0
g8n99fk,ja0ka0,The best bet would be to learn how to code before posting questions on Reddit about hypothetical things that will never happen in the future.,-6.0
g8mm9e9,j9r82n,"marked the video for later watch.

BTW is this is the paper from neurIPS 2020 which is receiving a lot of attention which seems to outperform CNNs?",2.0
g8mx3sb,j9r82n,"Yep, that's the one",3.0
g8niloj,j9r82n,"Thanks for marking it. This paper is currently under review at ICLR 2021. And yes, it's receiving a lot of attention because it achieves better results compared to CNN-based models when trained on a larger dataset.",1.0
g8l2aoh,j9pvnr,I released this blog post on end to end image classification last week. Let me know what you think about it :),1.0
g8kd128,j9jvgl," i assume u have done something related to nlp before

1. build a small Q&amp;A bot. a lot of people have done this before. resources are literally everywhere. 
2. kg-bert. if you are looking a bigger ( aka. cool) project , do some research on this one. [https://arxiv.org/abs/1909.03193](https://arxiv.org/abs/1909.03193), this is the paper's link. it is kinda cutting edge work, you gonna love it i guess.",2.0
g8kdmen,j9jvgl,"Yeah i have already made an Chatbot using RASA framework , it is a open source framework to develop textual and voice over chatbots

You can have a look at it . i have written a blog on that too :
https://medium.com/data-science-community-srm/developing-chatbots-with-rasa-intuition-to-implementation-39c1dd34274c",1.0
g8kt0bb,j9jvgl,then u should take a look at kg-bert. interesting research. still BerT but use triples as input.,1.0
g8k5e11,j9iwqz,It couldn't be one to one since you could invent any number of loss functions that could be used with a softmax final layer.,3.0
g8k8wvr,j9iwqz,No. All that matters is whats the input of the loss function. Whatever requires a probability needs a softmax (sigmoid if binary). The loss could be something completely irrelevant to cross entropy and would still require the last layer to be a softmax,3.0
g8k2puj,j9iwqz,"From my perspective the only thing that matters is, Sigmoid=bce, Softmax=cce/sparse cce, Linear=mse (and other mse variations). Other combos don't work theoretically and not practical imo. Feel free to correct me if anyone feels I'm wrong. Happy learn a thing or two.",5.0
g8lslrm,j9iwqz,Could you speak to why bce always goes with sigmoid? I would have guessed bce would work with any activation with the same output range.,1.0
g8lwdvj,j9iwqz,"Sigmoid will give you output between 0 and 1. Also if you notice the output dimensions for Sigmoid layer would be 1 (because it is binary). Hence, bce would be the only option here. Can you tell me other activation functions that gives you a single output between 0 and 1, other than Sigmoid?",2.0
g8m82et,j9iwqz,"I suppose you're right. I can brainstorm other mathmatical functions in that range [step function, saturated linear, (tanh(x)+1)/2] but I don't know any practical reason to use them for activations.",2.0
g8kdgj3,j9iwqz,"There is no such 'correspondence' since we need a loss function to account for proper handling of log loss and activation function for updates of our weights and biases while backpropagation. Every Activation function and loss functions are different for different purposes and sometimes, you will find they may work entirely in a different way! You have to explore them while working on a MODEL.

  
It all depends upon what sort of operation you are trying to achieve   
Like if you are performing a multi-class classification, then you have to use categorical cross-entropy as a loss function and softmax as an activation function. But we can also use different loss functions for Multi-class classification while keeping the activation softmax function as it is. So I don't think there is any such connection or link between them!",2.0
g8k7ip8,j9iwqz,How can I choose a loss function? What features/properties should I be looking for..?,0.0
g8k7xvu,j9iwqz,"There should not be any confusion choosing loss function. Because, most of the times you implement a network that's already been published on arxiv. So, they'll provide the best possible loss function for the given network.

If you are experimenting on a new deep learning technique, then you should check with different types of loss functions as well as optimization functions.",0.0
g8ky2n4,j9ivsw,Someone want to give a tldr (tldw?) for those of us who can't play audio right now?,5.0
g8kylsi,j9ivsw,"Sure, [here's the one](https://twitter.com/bhutanisanyam1/status/1309582455842639873?s=20) I wrote right after the interview",3.0
g8l20u5,j9ivsw,"Thanks!

TLDR: 3070 for students, 3080 for professionals. 3090 only if you are doing high resolution machine vision or pretraining NLP, where the extra RAM is useful.

Crazy detailed article: https://timdettmers.com/2020/09/07/which-gpu-for-deep-learning/

Interesting point: Nvidia made things a little awkward by dropping 1gb of vram from the 2080 ti to the 3080. Some existing pretrained models will be too big now. May require framework tricks to free up the extra vram.",2.0
g8l5l1i,j9ivsw,"&gt;Crazy detailed article

Thanks for the link, Tim Dettmers is the author of the article :) (The guest of this interview)

We're basically discussing the article + a Few FAQs here\^",1.0
g8kteho,j9ivsw,"Nice work. I’ve read Tims blog a few times and it’s great to have him talk through it. Thanks for this, keep up the good work.",2.0
g8kymin,j9ivsw,Thanks for watching and for the kind words! :),2.0
g8kuok0,j9ivsw,"Great job bhai..!! After reading his blog, it good to directly listen from him. You were mentioning about a community here in india, what community were you talking about?",2.0
g8kyndj,j9ivsw,"Thanks for watching :) 

I was referring to the ML Community in India, generally speaking!",2.0
g8kz0tw,j9ivsw,Oh. Thank you..!!,2.0
g8k8p48,j9hbho,"No.

It should be easy to see that it doesnt help by training with and without",1.0
g8j09r8,j9bi9v,Do u mean upsampling2d??,2.0
g8j2uxo,j9bi9v,"I want to do something like [this](https://www.researchgate.net/figure/An-illustration-of-two-types-of-unpooling-operations-a-simply-replacing-each-entry-of_fig9_323470988) , I can't do that with Upsampling2D",1.0
g8hy40r,j95938,"Some thoughts to try, in order from most likely to least likely:

Many of the base models in Keras come with their own data preprocessing function. Replace your data preprocessing layers with that one function call to guarantee correctness. https://www.tensorflow.org/api_docs/python/tf/keras/applications/xception/preprocess_input

Is there a reason you're sampling a mid-level of the base model (add_5) and not its last layer? I've never seen that pattern before. (You've set include_top=false so the last layer should be safe to use).

I would leave out that global average pooling 2d while debugging. Then once your model is training nicely you can try it and see what happens to accuracy.

If you unfreeze the base model, does it make training progress?",1.0
g8k1acy,j95938,"Thanks for response.

I have tried other blocks upto 11 but didn't go till last. Since the domain of the data is different so I thought initial blocks will provide basic elementary image related feature. Going deeper in the architecture might result is abstractions particular to the domain (eg. imagenet has object images which is different from brain electrophysiological data). However, will try and visualize what is the last block's output just to unturn every stone.

Are you suggesting straight flattening the feature output from the basemodel instead of global avarage pooling. If yes I did it with no avail.

The suggestion mentioned in the first point is I think incorporated as the normalization layer is added which is the preprocessing step for Xception model.

Actually, I did try unfreezing during the first round of training but due to less data model didn't gone well. 

However, I would revisit all the points just to crosscheck. 

Thanks.",1.0
g8kdlq2,j95938,"Oh. Your images are brain scans? Then the imagenet pretrained weights might not be very useful. To get good performance, I bet you would need to train without freezing and provide more training data.

The strategy I use is to freeze the base model and train (to get ok weights in the new layer). Then reduce the learning rate 10x, unfreeze the base model, and train some more.
https://keras.io/guides/transfer_learning/


With the preprocessing, I would still try replacing this:

norm_layer = keras.layers.experimental.preprocessing.Normalization()

...

norm_layer.set_weights([mean, var])


With this:

x = tf.keras.applications.xception.preprocess_input(x)

So you can be 100% sure it's preprocessing correctly.",1.0
g8hj5f3,j92tlz,I wanted to know more about using multiple PCIE risers in a 4x GPU system that I am going to build for deep learning. I was searching for some information regarding this for a very long time but couldn't find much out there. Your post helped me a lot. Thanks a ton!,2.0
g8hkxrq,j92tlz,Glad it helped! Deep learning is different from rendering with r/rendertoken but some of it should work the same.,2.0
g8hkysu,j92tlz,"Here's a sneak peek of /r/RenderToken using the [top posts](https://np.reddit.com/r/RenderToken/top/?sort=top&amp;t=year) of the year!

\#1: [AMA with Jules Urbach, CEO of OTOY/RNDR - ask questions for the AMA at 2pm PDT on 6/23!](https://np.reddit.com/r/RenderToken/comments/hcztqb/ama_with_jules_urbach_ceo_of_otoyrndr_ask/)  
\#2: [deadmau5 &amp; The Neptunes - Pomegranate (Official Music Video) - You guessed it, all done in Octane and partially rendered on the RNDR Network](https://www.youtube.com/watch?v=aAvyS6HSa0A) | [6 comments](https://np.reddit.com/r/RenderToken/comments/hk3wsf/deadmau5_the_neptunes_pomegranate_official_music/)  
\#3: [$RNDR Wins!! Lowest price for GPUs in this render farm test.](https://twitter.com/MacDaffy/status/1299345559044722688?s=20) | [16 comments](https://np.reddit.com/r/RenderToken/comments/ii7kub/rndr_wins_lowest_price_for_gpus_in_this_render/)

----
^^I'm ^^a ^^bot, ^^beep ^^boop ^^| ^^Downvote ^^to ^^remove ^^| [^^Contact ^^me](https://www.reddit.com/message/compose/?to=sneakpeekbot) ^^| [^^Info](https://np.reddit.com/r/sneakpeekbot/) ^^| [^^Opt-out](https://np.reddit.com/r/sneakpeekbot/comments/fpi5i6/blacklist_vii/)",2.0
g8hl0pd,j92tlz,"2pm PDT happens when this comment is 6 hours and 55 minutes old.

You can find the live countdown here: https://countle.com/LHDgcLKln

---

I'm a bot, if you want to send feedback, please comment below or send a PM.",1.0
g8hnaxy,j92tlz,it just happened. bots are taking over the conversation.,1.0
g8go87l,j927ey,"You either scrape it or find an existing dataset. There is also the option of buying datasets, but if you're new it might be expensive for you.

In your case, https://www.kaggle.com/techsash/waste-classification-data is a good start.",4.0
g8h1389,j927ey,"Thanks

but where can I buy image datasets?",2.0
g8h2db3,j927ey,You could sign up on Microsoft for Bing APIs (paying some amount monthly) and use the key to create your own custom datasets.,2.0
g8h2wjt,j927ey,A free flickr downloader would probably be a better option,3.0
g8h6p6c,j927ey,"Unsplash released last month for high quality images.

https://unsplash.com/data",3.0
g8h8jdb,j927ey,"Ohhh, that's awesome. Gotta love Unsplash.",2.0
g8h9boa,j927ey,"That's great, indeed.",2.0
g8hfrrr,j927ey,**thank you**,1.0
g8gb352,j8zbbu,"Attention with ensembles. I don't think it will work they way you imagine it, as it will take too much memory to place in RAM and input sizes aren't the same. Also, there is absolutely no reason to do something like that, at least not in that way.

Routing has its benefits when you're routing for one task, because then you might end up developing multiple efficient subnetworks that end up making your model better than one without routing.",2.0
g8gdjdp,j8zbbu,"Its a difficult problem.. what you could do is, to have many ML/DL services and instead of have them all in one place, to implement a “smart routing main node” which automatically identifies the type of the input data and calls the corresponding ML/DL service.. at least it was a “near optimal” solution for me. Of course this solution will have some errors..",1.0
g8fcis1,j8x0rp,"Have a look at the fast.ai course, it’s free, amazingly good and very top down/hands on...",3.0
g8ge0oh,j8x0rp,As you are a youngling try to focus on statistics and probability rather than Deep learning frameworks or even deep learning. Start with maybe Khan Academy's college/AP statistics and probability.,1.0
g8i9igd,j8x0rp,Stanfords Computer Vision Course should be fun! http://cs231n.stanford.edu,1.0
g8jb549,j8x0rp,"Hi, I am currently actually doing the same thing! 

I am taking Udacity’s deep learning course and I am writing articles on medium about the concepts I find difficult. This really helps solidify the information! Additionally if something peaks my interest (like the basic idea of perceptrons) I try to build them myself and write articles about them.

I recommend maybe retaking the course, and maybe writing some articles on the concepts that are difficult. Since you have taken it once you should be able to skim through a lot of information. 

If you want to start building check out PyTorch 60 mintue Blitz : https://pytorch.org/tutorials/beginner/deep_learning_60min_blitz.html

Maybe try the same approach a.k.a write about the things you find difficult!

If you have anymore questions feel free to message me.",1.0
g8koder,j8x0rp,"Hello! My name is Alejandro and I am 18 years old. I started in Machine Learning when I was 15 years old. My recommendation for everyone is to start with courses like Linear Algebra. Statics and probabilities. You need to understand concepts. Only that! You can follow me on all social networks as ""@lexandermorales"". 5 months ago I posted my video on: ""How to get started in AI if I am a teenager"".

[https://www.youtube.com/channel/UCAHSbPZyWCuXKyoM8rnnNYA?view\_as=subscriber](https://www.youtube.com/channel/UCAHSbPZyWCuXKyoM8rnnNYA?view_as=subscriber)",1.0
g8eo1qy,j8vc46,[deleted],1.0
g8eohr5,j8vc46,[deleted],1.0
g8eok90,j8vc46,Is ram important for sequence data in general.,1.0
g8ee8rf,j8tb9y,Use something premade like https://neuro-ai.co.uk you never have to touch cloud infrastructure it’s made for you. You’re charged only for the compute time on GPUs,1.0
g8fd0yl,j8tb9y,This is one of the reasons I’m building [seeme.ai](https://seeme.ai).,1.0
g8fbeoj,j8s3dn,"Some of these have pretrained ones and a GitHub to run them

https://paperswithcode.com/task/image-super-resolution


ESRGAN has one that I have used many times before.",1.0
g8gab51,j8lk2h,This is a great piece of work and very good engineering.,1.0
g8h9v1y,j8lk2h,"Thanks, I really appreciate your comment!

Hope you got some value from it.",2.0
g8hsjpv,j8lk2h,Curious if multiprocessing made any sense to get around the GIL? Maybe to complicated in the code flow?,1.0
g8ldbhq,j8lk2h,That’s a lot of FPS. Are you sure?,1.0
g8cqg5t,j8leeg,"Since deep learning of structured time series isn't my forte I won't try to answer, but I do have one or two best practices that should apply -  

1. No matter how you store the data, you probably want a way to store a local cache so you do not have to wait for the data when debugging or when you spin an instance. 

2. Don't wait for later, implement pipeline testing. I suggest GreatExpectations.

Hope this helps!",3.0
g8cu5uq,j8leeg,"thanks, I'll see what I can do.",1.0
g8avmg8,j8gb26,"neat, but what's this got to do with deep learning?",23.0
g8aw5w5,j8gb26,and the code isn't in the comments...,3.0
g8bqb4v,j8gb26,This has nothing at all to do with deep learning and should be removed from this sub.,9.0
g8brima,j8gb26,okay cool but why in this sub?,5.0
g8azc6f,j8gb26,"Well done!  
Always glad to see people using C#.

Recently just built a small camera app for computer vision on UWP in C#, hoping to add some prediction models to it later this year. Big fan of the language,",0.0
g8bpl8t,j8gb26,It'd be actually interesting to see deep learning application for building cartoon stories start to end by itself.,0.0
g8ac9yn,j8a0gy,"I think making your own projects is one of the things you could try. It's incredibly helpful, because in the course there's a lot of code that is just given to you, and while building something from scratch, you have to go through the entire process by yourself. I found it to help my understanding of both the models and the process. You could hop onto Kaggle and try participating in one of the competitions there, or just pick up one of their datasets and build your own thing with it.  

Personally, I've found the courses to be a great starting point. But it was only after finishing one or two pet projects that I gained some confidence in the knowledge. The projects don't have to be anything super fancy or reality shattering, it could just be something simple. The aim is to just get started. And once you do, you'll discover a lot of things that are done practically that the course didn't teach you (although for a good reason). This helped me when I finished the specialization, I hope it helps you too :)",3.0
g8axh3n,j8a0gy,Thanks a lot,1.0
g8altwo,j8a0gy,"
Hi There.  Glad to hear you finished the first step of learning deep learning. That's very clever of you. Now, I bet you have a basic understanding of deep learning. For instance,  the concept of gradient descent,gradient vanish... What is object detection, why LSTM have a better performance than RNN etc. Things like what I just mentioned is particularly essential for building up a much more complicated architectures like transformer and reading state of the art papers published recently. If you have no idea what I just talked about, please watch that specialization again. A robust basis of deep learning is the key to make groundbreaking works in your research journey.

  Now,let focus on what you need to do in the next step. Learning a deep learning framework like pytorch. There is a saying that practice makes perfect. What you just learned is just a bunch of theoretical knowledge. It is dramatically different in practice. A lot theories may not work as you read in the books.Also deep learning is still quite a empirical process, so it's important to gain some practical tuning hyper parameters experiences which you will never get from Ng's lectures. So learn a framework then apply it to your practice.
  By the way, when it comes to learning a framework, here are a series of questions and problems you are gonna need search the answer for yourself.
 1.which framework you wanna use? There is pytorch for research and TensorFlow for application in real world. It Its on what you wanna do with the framework. I am currently using pytorch.
2. Find some learning materials of learning framework.
3. Find some actual projects to practice.
For these two problems, I suggest you to look up in github.

 I still got a lot to share with you, but....

You have a nice day!

I am not a native speaker and i am currently practice my English writing skill. So I looking forward to any of your advice. Thanks a million : )",2.0
g8as5bd,j8a0gy,"Really appreciated that, thanks. I was about to start learning pytorch. Do you recommend a path for that?",1.0
g8axzeb,j8a0gy,"Read papers

You probably want to get a list of important architectures up until now and study those papers first, I don't know if that course goes that in depth (doubt it does).

Once you find something that you like or you get an idea for something, try implementing it. For an example, as I was reading up on RNNs I stumbled upon Differentiable Neural Computers. The concept of a memory networks interested me, so I kind of experiment with certain ideas relating to them ever since. Eventually by reading papers you're going to find something that sparks joy in you, but to know whether it is sane and worth you probably need to know if a better solution exists, and that requires reading a lot of papers.",2.0
